DATE,YEAR,MONTH,DAY, HR ,LUZON,VISAYAS,MINDANAO,PH
1/1/2013,2013,1,1, 1 ,4303,1100,928,6331
1/1/2013,2013,1,1, 2 ,3918,965,819,5702
1/1/2013,2013,1,1, 3 ,3709,903,761,5373
1/1/2013,2013,1,1, 4 ,3529,864,728,5121
1/1/2013,2013,1,1, 5 ,3450,848,731,5029
1/1/2013,2013,1,1, 6 ,3411,815,677,4903
1/1/2013,2013,1,1, 7 ,3240,794,659,4693
1/1/2013,2013,1,1, 8 ,3292,810,673,4775
1/1/2013,2013,1,1, 9 ,3362,835,698,4895
1/1/2013,2013,1,1, 10 ,3461,867,713,5041
1/1/2013,2013,1,1, 11 ,3699,896,748,5343
1/1/2013,2013,1,1, 12 ,3945,942,780,5667
1/1/2013,2013,1,1, 13 ,3921,941,792,5654
1/1/2013,2013,1,1, 14 ,3945,955,800,5700
1/1/2013,2013,1,1, 15 ,3889,948,805,5642
1/1/2013,2013,1,1, 16 ,3861,934,802,5597
1/1/2013,2013,1,1, 17 ,3883,924,798,5605
1/1/2013,2013,1,1, 18 ,4558,1163,969,6690
1/1/2013,2013,1,1, 19 ,4800,1226,1007,7033
1/1/2013,2013,1,1, 20 ,4791,1176,1027,6994
1/1/2013,2013,1,1, 21 ,4668,1120,973,6761
1/1/2013,2013,1,1, 22 ,4406,1034,886,6326
1/1/2013,2013,1,1, 23 ,4075,951,811,5837
1/1/2013,2013,1,1, 24 ,3794,889,766,5449
1/2/2013,2013,1,2, 1 ,3657,863,732,5252
1/2/2013,2013,1,2, 2 ,3545,842,710,5097
1/2/2013,2013,1,2, 3 ,3437,818,690,4945
1/2/2013,2013,1,2, 4 ,3373,808,678,4859
1/2/2013,2013,1,2, 5 ,3418,820,686,4924
1/2/2013,2013,1,2, 6 ,3588,836,711,5135
1/2/2013,2013,1,2, 7 ,3781,850,733,5364
1/2/2013,2013,1,2, 8 ,4375,949,820,6144
1/2/2013,2013,1,2, 9 ,5110,1124,952,7186
1/2/2013,2013,1,2, 10 ,5701,1215,1042,7958
1/2/2013,2013,1,2, 11 ,6011,1253,1083,8347
1/2/2013,2013,1,2, 12 ,5976,1252,1069,8297
1/2/2013,2013,1,2, 13 ,5950,1251,1055,8256
1/2/2013,2013,1,2, 14 ,6115,1271,1082,8468
1/2/2013,2013,1,2, 15 ,6036,1264,1031,8331
1/2/2013,2013,1,2, 16 ,5944,1245,1073,8262
1/2/2013,2013,1,2, 17 ,5676,1209,1082,7967
1/2/2013,2013,1,2, 18 ,6061,1382,1198,8641
1/2/2013,2013,1,2, 19 ,6092,1381,1180,8653
1/2/2013,2013,1,2, 20 ,5874,1325,1129,8328
1/2/2013,2013,1,2, 21 ,5676,1239,1055,7970
1/2/2013,2013,1,2, 22 ,5371,1151,954,7476
1/2/2013,2013,1,2, 23 ,4944,1054,865,6863
1/2/2013,2013,1,2, 24 ,4675,976,794,6445
1/3/2013,2013,1,3, 1 ,4446,907,766,6119
1/3/2013,2013,1,3, 2 ,4273,886,746,5905
1/3/2013,2013,1,3, 3 ,4153,872,733,5758
1/3/2013,2013,1,3, 4 ,4160,871,724,5755
1/3/2013,2013,1,3, 5 ,4213,890,724,5827
1/3/2013,2013,1,3, 6 ,4372,924,780,6076
1/3/2013,2013,1,3, 7 ,4577,927,775,6279
1/3/2013,2013,1,3, 8 ,5075,1010,859,6944
1/3/2013,2013,1,3, 9 ,5810,1175,1026,8011
1/3/2013,2013,1,3, 10 ,6309,1253,1095,8657
1/3/2013,2013,1,3, 11 ,6531,1293,1150,8974
1/3/2013,2013,1,3, 12 ,6446,1263,1151,8860
1/3/2013,2013,1,3, 13 ,6353,1257,1148,8758
1/3/2013,2013,1,3, 14 ,6556,1310,1171,9037
1/3/2013,2013,1,3, 15 ,6403,1303,1159,8865
1/3/2013,2013,1,3, 16 ,6359,1279,1134,8772
1/3/2013,2013,1,3, 17 ,6167,1253,1108,8528
1/3/2013,2013,1,3, 18 ,6454,1422,1233,9109
1/3/2013,2013,1,3, 19 ,6457,1414,1222,9093
1/3/2013,2013,1,3, 20 ,6220,1337,1183,8740
1/3/2013,2013,1,3, 21 ,6010,1264,1116,8390
1/3/2013,2013,1,3, 22 ,5636,1150,995,7781
1/3/2013,2013,1,3, 23 ,5237,1063,891,7191
1/3/2013,2013,1,3, 24 ,4878,993,835,6706
1/4/2013,2013,1,4, 1 ,4734,952,789,6475
1/4/2013,2013,1,4, 2 ,4509,920,769,6198
1/4/2013,2013,1,4, 3 ,4428,888,737,6053
1/4/2013,2013,1,4, 4 ,4349,881,747,5977
1/4/2013,2013,1,4, 5 ,4388,893,769,6050
1/4/2013,2013,1,4, 6 ,4612,934,792,6338
1/4/2013,2013,1,4, 7 ,4715,933,791,6439
1/4/2013,2013,1,4, 8 ,5237,1043,874,7154
1/4/2013,2013,1,4, 9 ,5963,1212,983,8158
1/4/2013,2013,1,4, 10 ,6383,1290,1106,8779
1/4/2013,2013,1,4, 11 ,6686,1342,1135,9163
1/4/2013,2013,1,4, 12 ,6532,1318,1101,8951
1/4/2013,2013,1,4, 13 ,6460,1307,1110,8877
1/4/2013,2013,1,4, 14 ,6624,1355,1143,9122
1/4/2013,2013,1,4, 15 ,6577,1334,1130,9041
1/4/2013,2013,1,4, 16 ,6520,1314,1140,8974
1/4/2013,2013,1,4, 17 ,6209,1260,1099,8568
1/4/2013,2013,1,4, 18 ,6469,1426,1223,9118
1/4/2013,2013,1,4, 19 ,6491,1428,1207,9126
1/4/2013,2013,1,4, 20 ,6235,1372,1174,8781
1/4/2013,2013,1,4, 21 ,6090,1298,1124,8512
1/4/2013,2013,1,4, 22 ,5697,1180,1007,7884
1/4/2013,2013,1,4, 23 ,5421,1082,908,7411
1/4/2013,2013,1,4, 24 ,5044,1008,841,6893
1/5/2013,2013,1,5, 1 ,4807,959,807,6573
1/5/2013,2013,1,5, 2 ,4688,923,781,6392
1/5/2013,2013,1,5, 3 ,4552,906,761,6219
1/5/2013,2013,1,5, 4 ,4421,897,758,6076
1/5/2013,2013,1,5, 5 ,4449,906,770,6125
1/5/2013,2013,1,5, 6 ,4562,916,787,6265
1/5/2013,2013,1,5, 7 ,4536,917,787,6240
1/5/2013,2013,1,5, 8 ,4976,995,843,6814
1/5/2013,2013,1,5, 9 ,5625,1130,939,7694
1/5/2013,2013,1,5, 10 ,6003,1215,1035,8253
1/5/2013,2013,1,5, 11 ,6199,1260,1093,8552
1/5/2013,2013,1,5, 12 ,6148,1234,1088,8470
1/5/2013,2013,1,5, 13 ,6074,1220,1101,8395
1/5/2013,2013,1,5, 14 ,6248,1250,1126,8624
1/5/2013,2013,1,5, 15 ,6130,1220,1110,8460
1/5/2013,2013,1,5, 16 ,6002,1199,1081,8282
1/5/2013,2013,1,5, 17 ,5788,1168,1072,8028
1/5/2013,2013,1,5, 18 ,6231,1365,1232,8828
1/5/2013,2013,1,5, 19 ,6341,1396,1228,8965
1/5/2013,2013,1,5, 20 ,6183,1341,1181,8705
1/5/2013,2013,1,5, 21 ,6061,1274,1145,8480
1/5/2013,2013,1,5, 22 ,5710,1169,1017,7896
1/5/2013,2013,1,5, 23 ,5373,1068,933,7374
1/5/2013,2013,1,5, 24 ,5044,994,858,6896
1/6/2013,2013,1,6, 1 ,4755,946,821,6522
1/6/2013,2013,1,6, 2 ,4642,913,788,6343
1/6/2013,2013,1,6, 3 ,4466,889,766,6121
1/6/2013,2013,1,6, 4 ,4443,872,759,6074
1/6/2013,2013,1,6, 5 ,4404,870,757,6031
1/6/2013,2013,1,6, 6 ,4409,866,764,6039
1/6/2013,2013,1,6, 7 ,4300,854,751,5905
1/6/2013,2013,1,6, 8 ,4459,908,766,6133
1/6/2013,2013,1,6, 9 ,4849,988,831,6668
1/6/2013,2013,1,6, 10 ,5235,1066,893,7194
1/6/2013,2013,1,6, 11 ,5489,1117,951,7557
1/6/2013,2013,1,6, 12 ,5535,1131,944,7610
1/6/2013,2013,1,6, 13 ,5440,1121,940,7501
1/6/2013,2013,1,6, 14 ,5504,1123,928,7555
1/6/2013,2013,1,6, 15 ,5440,1116,929,7485
1/6/2013,2013,1,6, 16 ,5331,1086,933,7350
1/6/2013,2013,1,6, 17 ,5203,1084,965,7252
1/6/2013,2013,1,6, 18 ,5833,1314,1117,8264
1/6/2013,2013,1,6, 19 ,6028,1341,1118,8487
1/6/2013,2013,1,6, 20 ,6042,1305,1076,8423
1/6/2013,2013,1,6, 21 ,5890,1220,992,8102
1/6/2013,2013,1,6, 22 ,5527,1130,860,7517
1/6/2013,2013,1,6, 23 ,5132,1041,818,6991
1/6/2013,2013,1,6, 24 ,4846,967,768,6581
1/7/2013,2013,1,7, 1 ,4564,904,731,6199
1/7/2013,2013,1,7, 2 ,4387,876,718,5981
1/7/2013,2013,1,7, 3 ,4268,854,694,5816
1/7/2013,2013,1,7, 4 ,4273,853,682,5808
1/7/2013,2013,1,7, 5 ,4431,888,740,6059
1/7/2013,2013,1,7, 6 ,4670,950,813,6433
1/7/2013,2013,1,7, 7 ,4811,938,760,6509
1/7/2013,2013,1,7, 8 ,5350,1032,832,7214
1/7/2013,2013,1,7, 9 ,6080,1221,959,8260
1/7/2013,2013,1,7, 10 ,6606,1329,1026,8961
1/7/2013,2013,1,7, 11 ,6967,1394,1095,9456
1/7/2013,2013,1,7, 12 ,6800,1366,1076,9242
1/7/2013,2013,1,7, 13 ,6776,1355,1049,9180
1/7/2013,2013,1,7, 14 ,6913,1358,1089,9360
1/7/2013,2013,1,7, 15 ,6866,1369,1083,9318
1/7/2013,2013,1,7, 16 ,6811,1342,1090,9243
1/7/2013,2013,1,7, 17 ,6510,1298,1107,8915
1/7/2013,2013,1,7, 18 ,6734,1462,1217,9413
1/7/2013,2013,1,7, 19 ,6850,1446,1148,9444
1/7/2013,2013,1,7, 20 ,6647,1370,1097,9114
1/7/2013,2013,1,7, 21 ,6374,1319,1046,8739
1/7/2013,2013,1,7, 22 ,6000,1207,906,8113
1/7/2013,2013,1,7, 23 ,5547,1083,841,7471
1/7/2013,2013,1,7, 24 ,5166,1013,764,6943
1/8/2013,2013,1,8, 1 ,4925,977,728,6630
1/8/2013,2013,1,8, 2 ,4717,938,702,6357
1/8/2013,2013,1,8, 3 ,4608,921,696,6225
1/8/2013,2013,1,8, 4 ,4570,920,717,6207
1/8/2013,2013,1,8, 5 ,4717,953,755,6425
1/8/2013,2013,1,8, 6 ,4900,1005,819,6724
1/8/2013,2013,1,8, 7 ,4972,967,830,6769
1/8/2013,2013,1,8, 8 ,5535,1046,870,7451
1/8/2013,2013,1,8, 9 ,6299,1238,992,8529
1/8/2013,2013,1,8, 10 ,6742,1323,1058,9123
1/8/2013,2013,1,8, 11 ,7023,1362,1115,9500
1/8/2013,2013,1,8, 12 ,6825,1321,1106,9252
1/8/2013,2013,1,8, 13 ,6792,1317,1078,9187
1/8/2013,2013,1,8, 14 ,6986,1359,1092,9437
1/8/2013,2013,1,8, 15 ,6879,1339,1093,9311
1/8/2013,2013,1,8, 16 ,6770,1326,1106,9202
1/8/2013,2013,1,8, 17 ,6475,1298,1111,8884
1/8/2013,2013,1,8, 18 ,6680,1455,1210,9345
1/8/2013,2013,1,8, 19 ,6829,1429,1168,9426
1/8/2013,2013,1,8, 20 ,6595,1345,1113,9053
1/8/2013,2013,1,8, 21 ,6355,1249,1061,8665
1/8/2013,2013,1,8, 22 ,5991,1130,924,8045
1/8/2013,2013,1,8, 23 ,5440,1027,864,7331
1/8/2013,2013,1,8, 24 ,5218,962,800,6980
1/9/2013,2013,1,9, 1 ,4882,924,740,6546
1/9/2013,2013,1,9, 2 ,4715,896,745,6356
1/9/2013,2013,1,9, 3 ,4617,880,723,6220
1/9/2013,2013,1,9, 4 ,4573,871,712,6156
1/9/2013,2013,1,9, 5 ,4773,914,748,6435
1/9/2013,2013,1,9, 6 ,5010,976,834,6820
1/9/2013,2013,1,9, 7 ,5053,942,776,6771
1/9/2013,2013,1,9, 8 ,5552,1036,875,7463
1/9/2013,2013,1,9, 9 ,6229,1213,1017,8459
1/9/2013,2013,1,9, 10 ,6733,1318,1104,9155
1/9/2013,2013,1,9, 11 ,6983,1377,1141,9501
1/9/2013,2013,1,9, 12 ,6797,1270,1122,9189
1/9/2013,2013,1,9, 13 ,6774,1296,1101,9171
1/9/2013,2013,1,9, 14 ,6965,1346,1130,9441
1/9/2013,2013,1,9, 15 ,6904,1317,1109,9330
1/9/2013,2013,1,9, 16 ,6786,1305,1120,9211
1/9/2013,2013,1,9, 17 ,6485,1252,1123,8860
1/9/2013,2013,1,9, 18 ,6687,1403,1223,9313
1/9/2013,2013,1,9, 19 ,6763,1430,1191,9384
1/9/2013,2013,1,9, 20 ,6569,1377,1122,9068
1/9/2013,2013,1,9, 21 ,6243,1295,1072,8610
1/9/2013,2013,1,9, 22 ,5912,1169,938,8019
1/9/2013,2013,1,9, 23 ,5426,1053,873,7352
1/9/2013,2013,1,9, 24 ,5060,984,780,6824
1/10/2013,2013,1,10, 1 ,4829,941,745,6515
1/10/2013,2013,1,10, 2 ,4629,912,722,6263
1/10/2013,2013,1,10, 3 ,4519,913,715,6147
1/10/2013,2013,1,10, 4 ,4465,892,716,6073
1/10/2013,2013,1,10, 5 ,4625,940,754,6319
1/10/2013,2013,1,10, 6 ,4821,977,806,6604
1/10/2013,2013,1,10, 7 ,4851,963,820,6634
1/10/2013,2013,1,10, 8 ,5463,1035,850,7348
1/10/2013,2013,1,10, 9 ,6180,1203,956,8339
1/10/2013,2013,1,10, 10 ,6621,1284,1040,8945
1/10/2013,2013,1,10, 11 ,6859,1320,1067,9246
1/10/2013,2013,1,10, 12 ,6663,1258,1041,8962
1/10/2013,2013,1,10, 13 ,6606,1228,1034,8868
1/10/2013,2013,1,10, 14 ,6814,1260,1055,9129
1/10/2013,2013,1,10, 15 ,6695,1239,1063,8997
1/10/2013,2013,1,10, 16 ,6618,1246,1074,8938
1/10/2013,2013,1,10, 17 ,6328,1238,1049,8615
1/10/2013,2013,1,10, 18 ,6528,1392,1184,9104
1/10/2013,2013,1,10, 19 ,6598,1371,1161,9130
1/10/2013,2013,1,10, 20 ,6447,1288,1101,8836
1/10/2013,2013,1,10, 21 ,6171,1204,1045,8420
1/10/2013,2013,1,10, 22 ,5689,1076,918,7683
1/10/2013,2013,1,10, 23 ,5315,974,852,7141
1/10/2013,2013,1,10, 24 ,4973,911,772,6656
1/11/2013,2013,1,11, 1 ,4684,874,750,6308
1/11/2013,2013,1,11, 2 ,4595,854,739,6188
1/11/2013,2013,1,11, 3 ,4505,837,736,6078
1/11/2013,2013,1,11, 4 ,4449,840,715,6004
1/11/2013,2013,1,11, 5 ,4625,879,760,6264
1/11/2013,2013,1,11, 6 ,4824,940,847,6611
1/11/2013,2013,1,11, 7 ,4938,928,814,6680
1/11/2013,2013,1,11, 8 ,5428,1004,850,7282
1/11/2013,2013,1,11, 9 ,6120,1177,1019,8316
1/11/2013,2013,1,11, 10 ,6544,1266,1100,8910
1/11/2013,2013,1,11, 11 ,6699,1308,1135,9142
1/11/2013,2013,1,11, 12 ,6488,1275,1122,8885
1/11/2013,2013,1,11, 13 ,6349,1300,1111,8760
1/11/2013,2013,1,11, 14 ,6527,1313,1149,8989
1/11/2013,2013,1,11, 15 ,6429,1291,1146,8866
1/11/2013,2013,1,11, 16 ,6374,1275,1134,8783
1/11/2013,2013,1,11, 17 ,6196,1236,1111,8543
1/11/2013,2013,1,11, 18 ,6492,1385,1229,9106
1/11/2013,2013,1,11, 19 ,6422,1399,1222,9043
1/11/2013,2013,1,11, 20 ,6257,1331,1182,8770
1/11/2013,2013,1,11, 21 ,6008,1248,1127,8383
1/11/2013,2013,1,11, 22 ,5612,1124,1023,7759
1/11/2013,2013,1,11, 23 ,5174,1026,914,7114
1/11/2013,2013,1,11, 24 ,4881,953,829,6663
1/12/2013,2013,1,12, 1 ,4579,911,795,6285
1/12/2013,2013,1,12, 2 ,4483,884,771,6138
1/12/2013,2013,1,12, 3 ,4379,874,754,6007
1/12/2013,2013,1,12, 4 ,4272,853,740,5865
1/12/2013,2013,1,12, 5 ,4347,864,758,5969
1/12/2013,2013,1,12, 6 ,4425,900,776,6101
1/12/2013,2013,1,12, 7 ,4562,906,774,6242
1/12/2013,2013,1,12, 8 ,4978,970,826,6774
1/12/2013,2013,1,12, 9 ,5470,1091,950,7511
1/12/2013,2013,1,12, 10 ,5865,1174,1023,8062
1/12/2013,2013,1,12, 11 ,6211,1224,1105,8540
1/12/2013,2013,1,12, 12 ,6043,1209,1089,8341
1/12/2013,2013,1,12, 13 ,5934,1205,1079,8218
1/12/2013,2013,1,12, 14 ,6061,1231,1103,8395
1/12/2013,2013,1,12, 15 ,5940,1201,1088,8229
1/12/2013,2013,1,12, 16 ,5787,1175,1070,8032
1/12/2013,2013,1,12, 17 ,5710,1165,1071,7946
1/12/2013,2013,1,12, 18 ,6089,1359,1205,8653
1/12/2013,2013,1,12, 19 ,6173,1405,1214,8792
1/12/2013,2013,1,12, 20 ,6056,1341,1163,8560
1/12/2013,2013,1,12, 21 ,5896,1292,1103,8291
1/12/2013,2013,1,12, 22 ,5526,1174,1022,7722
1/12/2013,2013,1,12, 23 ,5067,1075,919,7061
1/12/2013,2013,1,12, 24 ,4795,1005,843,6643
1/13/2013,2013,1,13, 1 ,4627,954,809,6390
1/13/2013,2013,1,13, 2 ,4444,930,769,6143
1/13/2013,2013,1,13, 3 ,4275,904,758,5937
1/13/2013,2013,1,13, 4 ,4193,891,735,5819
1/13/2013,2013,1,13, 5 ,4247,894,757,5898
1/13/2013,2013,1,13, 6 ,4242,893,767,5902
1/13/2013,2013,1,13, 7 ,4147,884,750,5781
1/13/2013,2013,1,13, 8 ,4397,934,782,6113
1/13/2013,2013,1,13, 9 ,4744,1011,842,6597
1/13/2013,2013,1,13, 10 ,5165,1085,909,7159
1/13/2013,2013,1,13, 11 ,5427,1126,959,7512
1/13/2013,2013,1,13, 12 ,5384,1132,964,7480
1/13/2013,2013,1,13, 13 ,5396,1130,962,7488
1/13/2013,2013,1,13, 14 ,5384,1123,941,7448
1/13/2013,2013,1,13, 15 ,5239,1111,927,7277
1/13/2013,2013,1,13, 16 ,5210,1092,915,7217
1/13/2013,2013,1,13, 17 ,5192,1108,922,7222
1/13/2013,2013,1,13, 18 ,5736,1291,1124,8151
1/13/2013,2013,1,13, 19 ,5928,1362,1157,8447
1/13/2013,2013,1,13, 20 ,5866,1315,1130,8311
1/13/2013,2013,1,13, 21 ,5596,1236,1066,7898
1/13/2013,2013,1,13, 22 ,5229,1146,969,7344
1/13/2013,2013,1,13, 23 ,4902,1053,868,6823
1/13/2013,2013,1,13, 24 ,4558,989,819,6366
1/14/2013,2013,1,14, 1 ,4322,942,779,6043
1/14/2013,2013,1,14, 2 ,4142,907,745,5794
1/14/2013,2013,1,14, 3 ,4018,886,724,5628
1/14/2013,2013,1,14, 4 ,4011,883,725,5619
1/14/2013,2013,1,14, 5 ,4229,915,749,5893
1/14/2013,2013,1,14, 6 ,4499,977,831,6307
1/14/2013,2013,1,14, 7 ,4635,952,766,6353
1/14/2013,2013,1,14, 8 ,5203,1050,845,7098
1/14/2013,2013,1,14, 9 ,5870,1234,1017,8121
1/14/2013,2013,1,14, 10 ,6276,1335,1154,8765
1/14/2013,2013,1,14, 11 ,6504,1402,1202,9108
1/14/2013,2013,1,14, 12 ,6293,1371,1189,8853
1/14/2013,2013,1,14, 13 ,6230,1351,1193,8774
1/14/2013,2013,1,14, 14 ,6423,1396,1233,9052
1/14/2013,2013,1,14, 15 ,6402,1359,1230,8991
1/14/2013,2013,1,14, 16 ,6341,1346,1209,8896
1/14/2013,2013,1,14, 17 ,6196,1314,1174,8684
1/14/2013,2013,1,14, 18 ,6465,1433,1267,9165
1/14/2013,2013,1,14, 19 ,6420,1443,1250,9113
1/14/2013,2013,1,14, 20 ,6196,1386,1203,8785
1/14/2013,2013,1,14, 21 ,5928,1306,1181,8415
1/14/2013,2013,1,14, 22 ,5512,1182,1072,7766
1/14/2013,2013,1,14, 23 ,5081,1073,974,7128
1/14/2013,2013,1,14, 24 ,4702,995,869,6566
1/15/2013,2013,1,15, 1 ,4481,948,848,6277
1/15/2013,2013,1,15, 2 ,4302,917,820,6039
1/15/2013,2013,1,15, 3 ,4192,896,790,5878
1/15/2013,2013,1,15, 4 ,4271,888,776,5935
1/15/2013,2013,1,15, 5 ,4407,923,819,6149
1/15/2013,2013,1,15, 6 ,4676,979,889,6544
1/15/2013,2013,1,15, 7 ,4682,957,821,6460
1/15/2013,2013,1,15, 8 ,5213,1027,891,7131
1/15/2013,2013,1,15, 9 ,5887,1192,1048,8127
1/15/2013,2013,1,15, 10 ,6276,1261,1133,8670
1/15/2013,2013,1,15, 11 ,6491,1291,1156,8938
1/15/2013,2013,1,15, 12 ,6310,1252,1146,8708
1/15/2013,2013,1,15, 13 ,6268,1223,1155,8646
1/15/2013,2013,1,15, 14 ,6427,1249,1171,8847
1/15/2013,2013,1,15, 15 ,6402,1243,1156,8801
1/15/2013,2013,1,15, 16 ,6252,1231,1158,8641
1/15/2013,2013,1,15, 17 ,6072,1204,1184,8460
1/15/2013,2013,1,15, 18 ,6252,1340,1223,8815
1/15/2013,2013,1,15, 19 ,6315,1347,1210,8872
1/15/2013,2013,1,15, 20 ,6077,1280,1189,8546
1/15/2013,2013,1,15, 21 ,5757,1193,1115,8065
1/15/2013,2013,1,15, 22 ,5370,1072,1000,7442
1/15/2013,2013,1,15, 23 ,4950,971,920,6841
1/15/2013,2013,1,15, 24 ,4596,900,856,6352
1/16/2013,2013,1,16, 1 ,4429,873,809,6111
1/16/2013,2013,1,16, 2 ,4275,852,787,5914
1/16/2013,2013,1,16, 3 ,4236,837,787,5860
1/16/2013,2013,1,16, 4 ,4214,832,776,5822
1/16/2013,2013,1,16, 5 ,4366,871,822,6059
1/16/2013,2013,1,16, 6 ,4725,930,878,6533
1/16/2013,2013,1,16, 7 ,4788,909,847,6544
1/16/2013,2013,1,16, 8 ,5210,980,902,7092
1/16/2013,2013,1,16, 9 ,5847,1136,1050,8033
1/16/2013,2013,1,16, 10 ,6184,1217,1152,8553
1/16/2013,2013,1,16, 11 ,6412,1269,1207,8888
1/16/2013,2013,1,16, 12 ,6222,1226,1168,8616
1/16/2013,2013,1,16, 13 ,6202,1197,1177,8576
1/16/2013,2013,1,16, 14 ,6345,1233,1201,8779
1/16/2013,2013,1,16, 15 ,6307,1217,1197,8721
1/16/2013,2013,1,16, 16 ,6211,1219,1201,8631
1/16/2013,2013,1,16, 17 ,5994,1195,1134,8323
1/16/2013,2013,1,16, 18 ,6182,1328,1240,8750
1/16/2013,2013,1,16, 19 ,6332,1343,1238,8913
1/16/2013,2013,1,16, 20 ,6089,1273,1195,8557
1/16/2013,2013,1,16, 21 ,5780,1189,1178,8147
1/16/2013,2013,1,16, 22 ,5360,1068,1069,7497
1/16/2013,2013,1,16, 23 ,4882,958,930,6770
1/16/2013,2013,1,16, 24 ,4554,893,871,6318
1/17/2013,2013,1,17, 1 ,4307,857,815,5979
1/17/2013,2013,1,17, 2 ,4138,825,801,5764
1/17/2013,2013,1,17, 3 ,4084,811,773,5668
1/17/2013,2013,1,17, 4 ,4085,815,774,5674
1/17/2013,2013,1,17, 5 ,4255,856,807,5918
1/17/2013,2013,1,17, 6 ,4571,922,873,6366
1/17/2013,2013,1,17, 7 ,4591,901,812,6304
1/17/2013,2013,1,17, 8 ,5114,976,906,6996
1/17/2013,2013,1,17, 9 ,5724,1143,1073,7940
1/17/2013,2013,1,17, 10 ,6212,1232,1129,8573
1/17/2013,2013,1,17, 11 ,6505,1292,1202,8999
1/17/2013,2013,1,17, 12 ,6336,1235,1165,8736
1/17/2013,2013,1,17, 13 ,6245,1231,1178,8654
1/17/2013,2013,1,17, 14 ,6481,1271,1173,8925
1/17/2013,2013,1,17, 15 ,6337,1252,1175,8764
1/17/2013,2013,1,17, 16 ,6245,1248,1167,8660
1/17/2013,2013,1,17, 17 ,5954,1198,1135,8287
1/17/2013,2013,1,17, 18 ,6156,1347,1238,8741
1/17/2013,2013,1,17, 19 ,6335,1379,1239,8953
1/17/2013,2013,1,17, 20 ,6070,1305,1192,8567
1/17/2013,2013,1,17, 21 ,5792,1229,1153,8174
1/17/2013,2013,1,17, 22 ,5362,1099,1072,7533
1/17/2013,2013,1,17, 23 ,4899,1009,947,6855
1/17/2013,2013,1,17, 24 ,4632,933,862,6427
1/18/2013,2013,1,18, 1 ,4388,889,825,6102
1/18/2013,2013,1,18, 2 ,4306,878,812,5996
1/18/2013,2013,1,18, 3 ,4155,868,793,5816
1/18/2013,2013,1,18, 4 ,4189,856,794,5839
1/18/2013,2013,1,18, 5 ,4406,892,827,6125
1/18/2013,2013,1,18, 6 ,4673,939,876,6488
1/18/2013,2013,1,18, 7 ,4705,936,838,6479
1/18/2013,2013,1,18, 8 ,5237,1008,890,7135
1/18/2013,2013,1,18, 9 ,5759,1178,1069,8006
1/18/2013,2013,1,18, 10 ,6172,1262,1134,8568
1/18/2013,2013,1,18, 11 ,6393,1310,1157,8860
1/18/2013,2013,1,18, 12 ,6218,1247,1156,8621
1/18/2013,2013,1,18, 13 ,6148,1226,1132,8506
1/18/2013,2013,1,18, 14 ,6325,1274,1193,8792
1/18/2013,2013,1,18, 15 ,6233,1259,1188,8680
1/18/2013,2013,1,18, 16 ,6140,1241,1167,8548
1/18/2013,2013,1,18, 17 ,5915,1206,1135,8256
1/18/2013,2013,1,18, 18 ,6052,1331,1210,8593
1/18/2013,2013,1,18, 19 ,6212,1352,1191,8755
1/18/2013,2013,1,18, 20 ,5968,1281,1163,8412
1/18/2013,2013,1,18, 21 ,5772,1200,1153,8125
1/18/2013,2013,1,18, 22 ,5394,1091,1081,7566
1/18/2013,2013,1,18, 23 ,4967,984,930,6881
1/18/2013,2013,1,18, 24 ,4633,915,834,6382
1/19/2013,2013,1,19, 1 ,4359,873,795,6027
1/19/2013,2013,1,19, 2 ,4272,854,766,5892
1/19/2013,2013,1,19, 3 ,4155,836,770,5761
1/19/2013,2013,1,19, 4 ,4132,832,765,5729
1/19/2013,2013,1,19, 5 ,4185,849,779,5813
1/19/2013,2013,1,19, 6 ,4324,885,813,6022
1/19/2013,2013,1,19, 7 ,4449,892,821,6162
1/19/2013,2013,1,19, 8 ,4846,966,874,6686
1/19/2013,2013,1,19, 9 ,5314,1075,944,7333
1/19/2013,2013,1,19, 10 ,5672,1135,1009,7816
1/19/2013,2013,1,19, 11 ,5937,1174,1031,8142
1/19/2013,2013,1,19, 12 ,5753,1151,1028,7932
1/19/2013,2013,1,19, 13 ,5646,1128,1028,7802
1/19/2013,2013,1,19, 14 ,5754,1134,1035,7923
1/19/2013,2013,1,19, 15 ,5617,1112,1032,7761
1/19/2013,2013,1,19, 16 ,5454,1102,1033,7589
1/19/2013,2013,1,19, 17 ,5328,1101,1052,7481
1/19/2013,2013,1,19, 18 ,5590,1242,1158,7990
1/19/2013,2013,1,19, 19 ,5892,1294,1173,8359
1/19/2013,2013,1,19, 20 ,5654,1235,1118,8007
1/19/2013,2013,1,19, 21 ,5487,1166,1043,7696
1/19/2013,2013,1,19, 22 ,5045,1060,935,7040
1/19/2013,2013,1,19, 23 ,4668,970,829,6467
1/19/2013,2013,1,19, 24 ,4366,915,798,6079
1/20/2013,2013,1,20, 1 ,4152,868,769,5789
1/20/2013,2013,1,20, 2 ,4045,840,745,5630
1/20/2013,2013,1,20, 3 ,3920,817,725,5462
1/20/2013,2013,1,20, 4 ,3902,815,718,5435
1/20/2013,2013,1,20, 5 ,3903,816,734,5453
1/20/2013,2013,1,20, 6 ,3935,835,758,5528
1/20/2013,2013,1,20, 7 ,3929,834,756,5519
1/20/2013,2013,1,20, 8 ,4160,869,765,5794
1/20/2013,2013,1,20, 9 ,4417,923,814,6154
1/20/2013,2013,1,20, 10 ,4834,982,850,6666
1/20/2013,2013,1,20, 11 ,5092,1022,878,6992
1/20/2013,2013,1,20, 12 ,4977,1006,874,6857
1/20/2013,2013,1,20, 13 ,4924,998,866,6788
1/20/2013,2013,1,20, 14 ,4942,1004,872,6818
1/20/2013,2013,1,20, 15 ,4878,991,849,6718
1/20/2013,2013,1,20, 16 ,4825,978,862,6665
1/20/2013,2013,1,20, 17 ,4747,975,908,6630
1/20/2013,2013,1,20, 18 ,5135,1163,1078,7376
1/20/2013,2013,1,20, 19 ,5534,1237,1112,7883
1/20/2013,2013,1,20, 20 ,5432,1200,1085,7717
1/20/2013,2013,1,20, 21 ,5155,1106,1010,7271
1/20/2013,2013,1,20, 22 ,4771,1013,919,6703
1/20/2013,2013,1,20, 23 ,4460,928,876,6264
1/20/2013,2013,1,20, 24 ,4168,861,842,5871
1/21/2013,2013,1,21, 1 ,3894,819,733,5446
1/21/2013,2013,1,21, 2 ,3774,789,710,5273
1/21/2013,2013,1,21, 3 ,3711,777,687,5175
1/21/2013,2013,1,21, 4 ,3702,773,688,5163
1/21/2013,2013,1,21, 5 ,3952,813,738,5503
1/21/2013,2013,1,21, 6 ,4300,885,814,5999
1/21/2013,2013,1,21, 7 ,4405,869,801,6075
1/21/2013,2013,1,21, 8 ,4980,959,846,6785
1/21/2013,2013,1,21, 9 ,5660,1140,994,7794
1/21/2013,2013,1,21, 10 ,6206,1235,1093,8534
1/21/2013,2013,1,21, 11 ,6470,1301,1118,8889
1/21/2013,2013,1,21, 12 ,6307,1282,1101,8690
1/21/2013,2013,1,21, 13 ,6222,1269,1091,8582
1/21/2013,2013,1,21, 14 ,6453,1309,1107,8869
1/21/2013,2013,1,21, 15 ,6349,1305,1089,8743
1/21/2013,2013,1,21, 16 ,6306,1277,1089,8672
1/21/2013,2013,1,21, 17 ,6101,1221,1075,8397
1/21/2013,2013,1,21, 18 ,6260,1355,1152,8767
1/21/2013,2013,1,21, 19 ,6367,1401,1148,8916
1/21/2013,2013,1,21, 20 ,6153,1325,1131,8609
1/21/2013,2013,1,21, 21 ,5918,1252,1079,8249
1/21/2013,2013,1,21, 22 ,5456,1136,987,7579
1/21/2013,2013,1,21, 23 ,5024,1021,858,6903
1/21/2013,2013,1,21, 24 ,4754,944,803,6501
1/22/2013,2013,1,22, 1 ,4479,901,768,6148
1/22/2013,2013,1,22, 2 ,4350,879,742,5971
1/22/2013,2013,1,22, 3 ,4258,853,722,5833
1/22/2013,2013,1,22, 4 ,4241,848,725,5814
1/22/2013,2013,1,22, 5 ,4433,889,776,6098
1/22/2013,2013,1,22, 6 ,4722,955,854,6531
1/22/2013,2013,1,22, 7 ,4782,920,817,6519
1/22/2013,2013,1,22, 8 ,5297,1005,880,7182
1/22/2013,2013,1,22, 9 ,5973,1190,1000,8163
1/22/2013,2013,1,22, 10 ,6371,1261,1088,8720
1/22/2013,2013,1,22, 11 ,6647,1314,1099,9060
1/22/2013,2013,1,22, 12 ,6416,1284,1090,8790
1/22/2013,2013,1,22, 13 ,6377,1261,1062,8700
1/22/2013,2013,1,22, 14 ,6463,1318,1066,8847
1/22/2013,2013,1,22, 15 ,6360,1290,1070,8720
1/22/2013,2013,1,22, 16 ,6301,1269,1094,8664
1/22/2013,2013,1,22, 17 ,6086,1216,1084,8386
1/22/2013,2013,1,22, 18 ,6259,1356,1146,8761
1/22/2013,2013,1,22, 19 ,6388,1399,1148,8935
1/22/2013,2013,1,22, 20 ,6169,1320,1092,8581
1/22/2013,2013,1,22, 21 ,5862,1235,1020,8117
1/22/2013,2013,1,22, 22 ,5446,1124,935,7505
1/22/2013,2013,1,22, 23 ,4988,1016,818,6822
1/22/2013,2013,1,22, 24 ,4637,941,757,6335
1/23/2013,2013,1,23, 1 ,4389,892,722,6003
1/23/2013,2013,1,23, 2 ,4256,862,720,5838
1/23/2013,2013,1,23, 3 ,4136,840,702,5678
1/23/2013,2013,1,23, 4 ,4177,847,715,5739
1/23/2013,2013,1,23, 5 ,4354,891,746,5991
1/23/2013,2013,1,23, 6 ,4616,958,827,6401
1/23/2013,2013,1,23, 7 ,4710,921,810,6441
1/23/2013,2013,1,23, 8 ,5174,1000,849,7023
1/23/2013,2013,1,23, 9 ,5852,1180,994,8026
1/23/2013,2013,1,23, 10 ,6249,1263,1053,8565
1/23/2013,2013,1,23, 11 ,6422,1315,1114,8851
1/23/2013,2013,1,23, 12 ,6255,1280,1101,8636
1/23/2013,2013,1,23, 13 ,6198,1264,1056,8518
1/23/2013,2013,1,23, 14 ,6397,1303,1104,8804
1/23/2013,2013,1,23, 15 ,6298,1285,1100,8683
1/23/2013,2013,1,23, 16 ,6195,1267,1091,8553
1/23/2013,2013,1,23, 17 ,6012,1222,1084,8318
1/23/2013,2013,1,23, 18 ,6233,1370,1172,8775
1/23/2013,2013,1,23, 19 ,6335,1397,1175,8907
1/23/2013,2013,1,23, 20 ,6069,1336,1160,8565
1/23/2013,2013,1,23, 21 ,5837,1266,1118,8221
1/23/2013,2013,1,23, 22 ,5348,1132,1026,7506
1/23/2013,2013,1,23, 23 ,4846,1020,886,6752
1/23/2013,2013,1,23, 24 ,4495,945,829,6269
1/24/2013,2013,1,24, 1 ,4211,912,802,5925
1/24/2013,2013,1,24, 2 ,4138,885,779,5802
1/24/2013,2013,1,24, 3 ,4041,869,765,5675
1/24/2013,2013,1,24, 4 ,4018,867,750,5635
1/24/2013,2013,1,24, 5 ,4238,911,808,5957
1/24/2013,2013,1,24, 6 ,4524,970,872,6366
1/24/2013,2013,1,24, 7 ,4556,933,843,6332
1/24/2013,2013,1,24, 8 ,5052,1024,905,6981
1/24/2013,2013,1,24, 9 ,5747,1191,1016,7954
1/24/2013,2013,1,24, 10 ,6176,1279,1123,8578
1/24/2013,2013,1,24, 11 ,6440,1323,1153,8916
1/24/2013,2013,1,24, 12 ,6297,1276,1119,8692
1/24/2013,2013,1,24, 13 ,6275,1269,1156,8700
1/24/2013,2013,1,24, 14 ,6517,1295,1138,8950
1/24/2013,2013,1,24, 15 ,6410,1281,1136,8827
1/24/2013,2013,1,24, 16 ,6372,1268,1143,8783
1/24/2013,2013,1,24, 17 ,6120,1235,1146,8501
1/24/2013,2013,1,24, 18 ,6241,1356,1215,8812
1/24/2013,2013,1,24, 19 ,6445,1385,1190,9020
1/24/2013,2013,1,24, 20 ,6229,1329,1152,8710
1/24/2013,2013,1,24, 21 ,5945,1245,1106,8296
1/24/2013,2013,1,24, 22 ,5449,1117,1001,7567
1/24/2013,2013,1,24, 23 ,4987,1012,868,6867
1/24/2013,2013,1,24, 24 ,4630,948,831,6409
1/25/2013,2013,1,25, 1 ,4369,894,797,6060
1/25/2013,2013,1,25, 2 ,4293,875,774,5942
1/25/2013,2013,1,25, 3 ,4138,860,760,5758
1/25/2013,2013,1,25, 4 ,4136,853,771,5760
1/25/2013,2013,1,25, 5 ,4336,885,807,6028
1/25/2013,2013,1,25, 6 ,4612,948,877,6437
1/25/2013,2013,1,25, 7 ,4652,933,841,6426
1/25/2013,2013,1,25, 8 ,5121,1006,908,7035
1/25/2013,2013,1,25, 9 ,5798,1157,1066,8021
1/25/2013,2013,1,25, 10 ,6245,1249,1152,8646
1/25/2013,2013,1,25, 11 ,6590,1283,1184,9057
1/25/2013,2013,1,25, 12 ,6396,1234,1146,8776
1/25/2013,2013,1,25, 13 ,6407,1229,1143,8779
1/25/2013,2013,1,25, 14 ,6625,1266,1166,9057
1/25/2013,2013,1,25, 15 ,6513,1247,1143,8903
1/25/2013,2013,1,25, 16 ,6429,1243,1152,8824
1/25/2013,2013,1,25, 17 ,6208,1213,1139,8560
1/25/2013,2013,1,25, 18 ,6360,1346,1230,8936
1/25/2013,2013,1,25, 19 ,6527,1368,1205,9100
1/25/2013,2013,1,25, 20 ,6319,1300,1147,8766
1/25/2013,2013,1,25, 21 ,6133,1221,1114,8468
1/25/2013,2013,1,25, 22 ,5698,1119,1038,7855
1/25/2013,2013,1,25, 23 ,5279,1010,919,7208
1/25/2013,2013,1,25, 24 ,4881,932,852,6665
1/26/2013,2013,1,26, 1 ,4593,896,792,6281
1/26/2013,2013,1,26, 2 ,4493,868,779,6140
1/26/2013,2013,1,26, 3 ,4355,848,759,5962
1/26/2013,2013,1,26, 4 ,4328,846,748,5922
1/26/2013,2013,1,26, 5 ,4356,862,769,5987
1/26/2013,2013,1,26, 6 ,4504,870,808,6182
1/26/2013,2013,1,26, 7 ,4582,871,795,6248
1/26/2013,2013,1,26, 8 ,4938,929,825,6692
1/26/2013,2013,1,26, 9 ,5446,1048,928,7422
1/26/2013,2013,1,26, 10 ,5891,1139,980,8010
1/26/2013,2013,1,26, 11 ,6202,1198,1065,8465
1/26/2013,2013,1,26, 12 ,6050,1167,1055,8272
1/26/2013,2013,1,26, 13 ,5953,1151,1065,8169
1/26/2013,2013,1,26, 14 ,6085,1166,1014,8265
1/26/2013,2013,1,26, 15 ,5911,1127,1054,8092
1/26/2013,2013,1,26, 16 ,5751,1135,1044,7930
1/26/2013,2013,1,26, 17 ,5561,1141,1041,7743
1/26/2013,2013,1,26, 18 ,5885,1260,1185,8330
1/26/2013,2013,1,26, 19 ,6202,1334,1207,8743
1/26/2013,2013,1,26, 20 ,6001,1286,1155,8442
1/26/2013,2013,1,26, 21 ,5887,1223,1125,8235
1/26/2013,2013,1,26, 22 ,5530,1120,1037,7687
1/26/2013,2013,1,26, 23 ,5127,1005,915,7047
1/26/2013,2013,1,26, 24 ,4773,930,832,6535
1/27/2013,2013,1,27, 1 ,4534,884,799,6217
1/27/2013,2013,1,27, 2 ,4394,857,766,6017
1/27/2013,2013,1,27, 3 ,4270,836,741,5847
1/27/2013,2013,1,27, 4 ,4157,817,729,5703
1/27/2013,2013,1,27, 5 ,4153,836,754,5743
1/27/2013,2013,1,27, 6 ,4142,849,758,5749
1/27/2013,2013,1,27, 7 ,4099,840,734,5673
1/27/2013,2013,1,27, 8 ,4290,872,759,5921
1/27/2013,2013,1,27, 9 ,4634,947,824,6405
1/27/2013,2013,1,27, 10 ,5110,1016,885,7011
1/27/2013,2013,1,27, 11 ,5333,1053,931,7317
1/27/2013,2013,1,27, 12 ,5326,1054,940,7320
1/27/2013,2013,1,27, 13 ,5357,1064,957,7378
1/27/2013,2013,1,27, 14 ,5301,1063,971,7335
1/27/2013,2013,1,27, 15 ,5257,1049,955,7261
1/27/2013,2013,1,27, 16 ,5137,1029,938,7104
1/27/2013,2013,1,27, 17 ,5069,997,946,7012
1/27/2013,2013,1,27, 18 ,5473,1168,1068,7709
1/27/2013,2013,1,27, 19 ,5872,1261,1147,8280
1/27/2013,2013,1,27, 20 ,5816,1225,1115,8156
1/27/2013,2013,1,27, 21 ,5618,1150,1030,7798
1/27/2013,2013,1,27, 22 ,5214,1073,941,7228
1/27/2013,2013,1,27, 23 ,4873,987,864,6724
1/27/2013,2013,1,27, 24 ,4585,925,794,6304
1/28/2013,2013,1,28, 1 ,4334,877,768,5979
1/28/2013,2013,1,28, 2 ,4142,845,734,5721
1/28/2013,2013,1,28, 3 ,4085,824,705,5614
1/28/2013,2013,1,28, 4 ,4018,823,717,5558
1/28/2013,2013,1,28, 5 ,4270,863,764,5897
1/28/2013,2013,1,28, 6 ,4569,932,834,6335
1/28/2013,2013,1,28, 7 ,4693,910,793,6396
1/28/2013,2013,1,28, 8 ,5263,1003,849,7115
1/28/2013,2013,1,28, 9 ,6018,1185,1003,8206
1/28/2013,2013,1,28, 10 ,6506,1283,1102,8891
1/28/2013,2013,1,28, 11 ,6783,1337,1153,9273
1/28/2013,2013,1,28, 12 ,6640,1302,1132,9074
1/28/2013,2013,1,28, 13 ,6543,1284,1130,8957
1/28/2013,2013,1,28, 14 ,6818,1338,1180,9336
1/28/2013,2013,1,28, 15 ,6637,1324,1163,9124
1/28/2013,2013,1,28, 16 ,6539,1296,1143,8978
1/28/2013,2013,1,28, 17 ,6238,1234,1112,8584
1/28/2013,2013,1,28, 18 ,6284,1346,1188,8818
1/28/2013,2013,1,28, 19 ,6477,1420,1216,9113
1/28/2013,2013,1,28, 20 ,6223,1347,1184,8754
1/28/2013,2013,1,28, 21 ,5961,1266,1126,8353
1/28/2013,2013,1,28, 22 ,5555,1142,1000,7697
1/28/2013,2013,1,28, 23 ,5124,1026,881,7031
1/28/2013,2013,1,28, 24 ,4740,958,832,6530
1/29/2013,2013,1,29, 1 ,4551,913,795,6259
1/29/2013,2013,1,29, 2 ,4413,884,777,6074
1/29/2013,2013,1,29, 3 ,4307,855,748,5910
1/29/2013,2013,1,29, 4 ,4297,871,750,5918
1/29/2013,2013,1,29, 5 ,4465,905,795,6165
1/29/2013,2013,1,29, 6 ,4712,961,854,6527
1/29/2013,2013,1,29, 7 ,4742,928,799,6469
1/29/2013,2013,1,29, 8 ,5288,1025,883,7196
1/29/2013,2013,1,29, 9 ,5936,1204,1018,8158
1/29/2013,2013,1,29, 10 ,6251,1299,1128,8678
1/29/2013,2013,1,29, 11 ,6557,1354,1178,9089
1/29/2013,2013,1,29, 12 ,6377,1304,1133,8814
1/29/2013,2013,1,29, 13 ,6296,1305,1143,8744
1/29/2013,2013,1,29, 14 ,6498,1351,1168,9017
1/29/2013,2013,1,29, 15 ,6379,1329,1163,8871
1/29/2013,2013,1,29, 16 ,6244,1305,1147,8696
1/29/2013,2013,1,29, 17 ,6213,1265,1128,8606
1/29/2013,2013,1,29, 18 ,6219,1366,1230,8815
1/29/2013,2013,1,29, 19 ,6530,1418,1201,9149
1/29/2013,2013,1,29, 20 ,6249,1336,1169,8754
1/29/2013,2013,1,29, 21 ,5911,1239,1125,8275
1/29/2013,2013,1,29, 22 ,5531,1118,1011,7660
1/29/2013,2013,1,29, 23 ,5056,1012,885,6953
1/29/2013,2013,1,29, 24 ,4751,937,851,6539
1/30/2013,2013,1,30, 1 ,4489,906,824,6219
1/30/2013,2013,1,30, 2 ,4332,876,779,5987
1/30/2013,2013,1,30, 3 ,4224,858,768,5850
1/30/2013,2013,1,30, 4 ,4198,849,763,5810
1/30/2013,2013,1,30, 5 ,4407,886,816,6109
1/30/2013,2013,1,30, 6 ,4670,951,881,6502
1/30/2013,2013,1,30, 7 ,4705,928,829,6462
1/30/2013,2013,1,30, 8 ,5243,1007,905,7155
1/30/2013,2013,1,30, 9 ,5890,1168,1056,8114
1/30/2013,2013,1,30, 10 ,6341,1232,1140,8713
1/30/2013,2013,1,30, 11 ,6678,1271,1155,9104
1/30/2013,2013,1,30, 12 ,6438,1240,1133,8811
1/30/2013,2013,1,30, 13 ,6413,1203,1115,8731
1/30/2013,2013,1,30, 14 ,6592,1232,1141,8965
1/30/2013,2013,1,30, 15 ,6468,1216,1120,8804
1/30/2013,2013,1,30, 16 ,6379,1214,1133,8726
1/30/2013,2013,1,30, 17 ,6042,1195,1142,8379
1/30/2013,2013,1,30, 18 ,6051,1313,1197,8561
1/30/2013,2013,1,30, 19 ,6328,1331,1186,8845
1/30/2013,2013,1,30, 20 ,6082,1262,1158,8502
1/30/2013,2013,1,30, 21 ,5772,1163,1094,8029
1/30/2013,2013,1,30, 22 ,5380,1034,994,7408
1/30/2013,2013,1,30, 23 ,4894,934,885,6713
1/30/2013,2013,1,30, 24 ,4554,866,821,6241
1/31/2013,2013,1,31, 1 ,4345,839,789,5973
1/31/2013,2013,1,31, 2 ,4215,819,781,5815
1/31/2013,2013,1,31, 3 ,4164,807,757,5728
1/31/2013,2013,1,31, 4 ,4165,810,755,5730
1/31/2013,2013,1,31, 5 ,4373,846,811,6030
1/31/2013,2013,1,31, 6 ,4642,920,877,6439
1/31/2013,2013,1,31, 7 ,4727,901,806,6434
1/31/2013,2013,1,31, 8 ,5147,985,892,7024
1/31/2013,2013,1,31, 9 ,5751,1162,1033,7946
1/31/2013,2013,1,31, 10 ,6220,1264,1113,8597
1/31/2013,2013,1,31, 11 ,6546,1322,1158,9026
1/31/2013,2013,1,31, 12 ,6318,1296,1139,8753
1/31/2013,2013,1,31, 13 ,6230,1299,1139,8668
1/31/2013,2013,1,31, 14 ,6443,1342,1169,8954
1/31/2013,2013,1,31, 15 ,6336,1323,1174,8833
1/31/2013,2013,1,31, 16 ,6334,1304,1167,8805
1/31/2013,2013,1,31, 17 ,6115,1230,1094,8439
1/31/2013,2013,1,31, 18 ,6226,1329,1196,8751
1/31/2013,2013,1,31, 19 ,6425,1405,1204,9034
1/31/2013,2013,1,31, 20 ,6252,1346,1180,8778
1/31/2013,2013,1,31, 21 ,6035,1262,1137,8434
1/31/2013,2013,1,31, 22 ,5591,1139,1041,7771
1/31/2013,2013,1,31, 23 ,5146,1023,918,7087
1/31/2013,2013,1,31, 24 ,4870,947,842,6659
2/1/2013,2013,2,1, 1 ,4617,900,799,6316
2/1/2013,2013,2,1, 2 ,4466,873,766,6105
2/1/2013,2013,2,1, 3 ,4339,849,746,5934
2/1/2013,2013,2,1, 4 ,4348,847,747,5942
2/1/2013,2013,2,1, 5 ,4503,880,790,6173
2/1/2013,2013,2,1, 6 ,4799,940,864,6603
2/1/2013,2013,2,1, 7 ,4803,899,809,6511
2/1/2013,2013,2,1, 8 ,5399,999,878,7276
2/1/2013,2013,2,1, 9 ,6064,1205,1036,8305
2/1/2013,2013,2,1, 10 ,6539,1306,1133,8978
2/1/2013,2013,2,1, 11 ,6850,1371,1170,9391
2/1/2013,2013,2,1, 12 ,6700,1335,1165,9200
2/1/2013,2013,2,1, 13 ,6738,1306,1154,9198
2/1/2013,2013,2,1, 14 ,6954,1347,1209,9510
2/1/2013,2013,2,1, 15 ,6871,1319,1201,9391
2/1/2013,2013,2,1, 16 ,6810,1305,1177,9292
2/1/2013,2013,2,1, 17 ,6494,1230,1108,8832
2/1/2013,2013,2,1, 18 ,6410,1329,1190,8929
2/1/2013,2013,2,1, 19 ,6710,1377,1188,9275
2/1/2013,2013,2,1, 20 ,6489,1329,1190,9008
2/1/2013,2013,2,1, 21 ,6298,1254,1144,8696
2/1/2013,2013,2,1, 22 ,5849,1153,1058,8060
2/1/2013,2013,2,1, 23 ,5571,1054,961,7586
2/1/2013,2013,2,1, 24 ,5177,961,852,6990
2/2/2013,2013,2,2, 1 ,4921,917,823,6661
2/2/2013,2013,2,2, 2 ,4779,876,799,6454
2/2/2013,2013,2,2, 3 ,4619,859,778,6256
2/2/2013,2013,2,2, 4 ,4564,850,768,6182
2/2/2013,2013,2,2, 5 ,4577,865,787,6229
2/2/2013,2013,2,2, 6 ,4707,888,815,6410
2/2/2013,2013,2,2, 7 ,4712,893,812,6417
2/2/2013,2013,2,2, 8 ,5130,958,863,6951
2/2/2013,2013,2,2, 9 ,5656,1102,983,7741
2/2/2013,2013,2,2, 10 ,6143,1175,1036,8354
2/2/2013,2013,2,2, 11 ,6398,1241,1055,8694
2/2/2013,2013,2,2, 12 ,6269,1213,1035,8517
2/2/2013,2013,2,2, 13 ,6147,1201,1028,8376
2/2/2013,2013,2,2, 14 ,6219,1209,1056,8484
2/2/2013,2013,2,2, 15 ,6065,1189,1030,8284
2/2/2013,2013,2,2, 16 ,5895,1159,1020,8074
2/2/2013,2013,2,2, 17 ,5648,1121,1006,7775
2/2/2013,2013,2,2, 18 ,5796,1258,1116,8170
2/2/2013,2013,2,2, 19 ,6272,1349,1153,8774
2/2/2013,2013,2,2, 20 ,6123,1288,1116,8527
2/2/2013,2013,2,2, 21 ,5954,1229,1108,8291
2/2/2013,2013,2,2, 22 ,5666,1131,1011,7808
2/2/2013,2013,2,2, 23 ,5272,1027,917,7216
2/2/2013,2013,2,2, 24 ,4952,955,844,6751
2/3/2013,2013,2,3, 1 ,4774,909,800,6483
2/3/2013,2013,2,3, 2 ,4593,874,761,6228
2/3/2013,2013,2,3, 3 ,4427,851,747,6025
2/3/2013,2013,2,3, 4 ,4350,843,731,5924
2/3/2013,2013,2,3, 5 ,4324,848,746,5918
2/3/2013,2013,2,3, 6 ,4339,850,770,5959
2/3/2013,2013,2,3, 7 ,4274,834,763,5871
2/3/2013,2013,2,3, 8 ,4467,867,775,6109
2/3/2013,2013,2,3, 9 ,4770,927,822,6519
2/3/2013,2013,2,3, 10 ,5226,991,888,7105
2/3/2013,2013,2,3, 11 ,5441,1033,928,7402
2/3/2013,2013,2,3, 12 ,5420,1038,936,7394
2/3/2013,2013,2,3, 13 ,5435,1036,937,7408
2/3/2013,2013,2,3, 14 ,5421,1031,955,7407
2/3/2013,2013,2,3, 15 ,5294,1017,969,7280
2/3/2013,2013,2,3, 16 ,5157,972,937,7066
2/3/2013,2013,2,3, 17 ,5050,997,932,6979
2/3/2013,2013,2,3, 18 ,5402,1126,1041,7569
2/3/2013,2013,2,3, 19 ,5882,1205,1171,8258
2/3/2013,2013,2,3, 20 ,5816,1201,1128,8145
2/3/2013,2013,2,3, 21 ,5621,1137,1069,7827
2/3/2013,2013,2,3, 22 ,5289,1031,910,7230
2/3/2013,2013,2,3, 23 ,5000,940,862,6802
2/3/2013,2013,2,3, 24 ,4633,856,800,6289
2/4/2013,2013,2,4, 1 ,4398,821,753,5972
2/4/2013,2013,2,4, 2 ,4177,793,714,5684
2/4/2013,2013,2,4, 3 ,4115,782,715,5612
2/4/2013,2013,2,4, 4 ,4060,783,699,5542
2/4/2013,2013,2,4, 5 ,4232,826,761,5819
2/4/2013,2013,2,4, 6 ,4533,895,844,6272
2/4/2013,2013,2,4, 7 ,4667,865,783,6315
2/4/2013,2013,2,4, 8 ,5262,962,862,7086
2/4/2013,2013,2,4, 9 ,6040,1154,1070,8264
2/4/2013,2013,2,4, 10 ,6636,1256,1116,9008
2/4/2013,2013,2,4, 11 ,6876,1329,1158,9363
2/4/2013,2013,2,4, 12 ,6793,1304,1158,9255
2/4/2013,2013,2,4, 13 ,6716,1311,1139,9166
2/4/2013,2013,2,4, 14 ,6985,1344,1147,9476
2/4/2013,2013,2,4, 15 ,6907,1331,1138,9376
2/4/2013,2013,2,4, 16 ,6802,1313,1139,9254
2/4/2013,2013,2,4, 17 ,6426,1238,1132,8796
2/4/2013,2013,2,4, 18 ,6363,1325,1190,8878
2/4/2013,2013,2,4, 19 ,6718,1417,1177,9312
2/4/2013,2013,2,4, 20 ,6466,1342,1164,8972
2/4/2013,2013,2,4, 21 ,6188,1277,1156,8621
2/4/2013,2013,2,4, 22 ,5858,1161,1078,8097
2/4/2013,2013,2,4, 23 ,5395,1036,948,7379
2/4/2013,2013,2,4, 24 ,4977,956,880,6813
2/5/2013,2013,2,5, 1 ,4737,909,811,6457
2/5/2013,2013,2,5, 2 ,4614,885,825,6324
2/5/2013,2013,2,5, 3 ,4435,865,793,6093
2/5/2013,2013,2,5, 4 ,4437,861,791,6089
2/5/2013,2013,2,5, 5 ,4606,896,837,6339
2/5/2013,2013,2,5, 6 ,4777,955,912,6644
2/5/2013,2013,2,5, 7 ,4806,916,842,6564
2/5/2013,2013,2,5, 8 ,5424,1016,935,7375
2/5/2013,2013,2,5, 9 ,6137,1199,1087,8423
2/5/2013,2013,2,5, 10 ,6651,1271,1158,9080
2/5/2013,2013,2,5, 11 ,6881,1334,1162,9377
2/5/2013,2013,2,5, 12 ,6749,1307,1129,9185
2/5/2013,2013,2,5, 13 ,6733,1290,1143,9166
2/5/2013,2013,2,5, 14 ,6996,1338,1185,9519
2/5/2013,2013,2,5, 15 ,6903,1341,1178,9422
2/5/2013,2013,2,5, 16 ,6841,1316,1170,9327
2/5/2013,2013,2,5, 17 ,6490,1255,1119,8864
2/5/2013,2013,2,5, 18 ,6354,1346,1189,8889
2/5/2013,2013,2,5, 19 ,6771,1414,1231,9416
2/5/2013,2013,2,5, 20 ,6477,1333,1203,9013
2/5/2013,2013,2,5, 21 ,6240,1265,1189,8694
2/5/2013,2013,2,5, 22 ,5855,1150,1110,8115
2/5/2013,2013,2,5, 23 ,5354,1022,1083,7459
2/5/2013,2013,2,5, 24 ,4936,955,909,6800
2/6/2013,2013,2,6, 1 ,4707,913,853,6473
2/6/2013,2013,2,6, 2 ,4585,884,821,6290
2/6/2013,2013,2,6, 3 ,4426,864,809,6099
2/6/2013,2013,2,6, 4 ,4404,857,803,6064
2/6/2013,2013,2,6, 5 ,4589,899,850,6338
2/6/2013,2013,2,6, 6 ,4850,951,912,6713
2/6/2013,2013,2,6, 7 ,4831,921,848,6600
2/6/2013,2013,2,6, 8 ,5429,1016,922,7367
2/6/2013,2013,2,6, 9 ,6095,1210,1080,8385
2/6/2013,2013,2,6, 10 ,6622,1293,1167,9082
2/6/2013,2013,2,6, 11 ,6879,1361,1195,9435
2/6/2013,2013,2,6, 12 ,6730,1332,1163,9225
2/6/2013,2013,2,6, 13 ,6709,1309,1156,9174
2/6/2013,2013,2,6, 14 ,7027,1371,1179,9577
2/6/2013,2013,2,6, 15 ,6920,1370,1167,9457
2/6/2013,2013,2,6, 16 ,6811,1341,1132,9284
2/6/2013,2013,2,6, 17 ,6554,1272,1118,8944
2/6/2013,2013,2,6, 18 ,6450,1351,1207,9008
2/6/2013,2013,2,6, 19 ,6838,1445,1203,9486
2/6/2013,2013,2,6, 20 ,6631,1324,1183,9138
2/6/2013,2013,2,6, 21 ,6389,1257,1162,8808
2/6/2013,2013,2,6, 22 ,6032,1147,1102,8281
2/6/2013,2013,2,6, 23 ,5463,1016,981,7460
2/6/2013,2013,2,6, 24 ,5078,940,878,6896
2/7/2013,2013,2,7, 1 ,4841,904,848,6593
2/7/2013,2013,2,7, 2 ,4746,880,810,6436
2/7/2013,2013,2,7, 3 ,4616,875,783,6274
2/7/2013,2013,2,7, 4 ,4576,863,786,6225
2/7/2013,2013,2,7, 5 ,4733,907,828,6468
2/7/2013,2013,2,7, 6 ,4965,956,887,6808
2/7/2013,2013,2,7, 7 ,4980,916,823,6719
2/7/2013,2013,2,7, 8 ,5534,1018,906,7458
2/7/2013,2013,2,7, 9 ,6284,1209,1073,8566
2/7/2013,2013,2,7, 10 ,6734,1311,1173,9218
2/7/2013,2013,2,7, 11 ,7030,1376,1182,9588
2/7/2013,2013,2,7, 12 ,6834,1347,1149,9330
2/7/2013,2013,2,7, 13 ,6830,1332,1159,9321
2/7/2013,2013,2,7, 14 ,7131,1391,1192,9714
2/7/2013,2013,2,7, 15 ,7009,1369,1186,9564
2/7/2013,2013,2,7, 16 ,6868,1337,1164,9369
2/7/2013,2013,2,7, 17 ,6615,1254,1129,8998
2/7/2013,2013,2,7, 18 ,6622,1354,1211,9187
2/7/2013,2013,2,7, 19 ,6891,1438,1192,9521
2/7/2013,2013,2,7, 20 ,6652,1354,1170,9176
2/7/2013,2013,2,7, 21 ,6435,1299,1172,8906
2/7/2013,2013,2,7, 22 ,6038,1174,1111,8323
2/7/2013,2013,2,7, 23 ,5583,1052,977,7612
2/7/2013,2013,2,7, 24 ,5135,961,908,7004
2/8/2013,2013,2,8, 1 ,4873,933,861,6667
2/8/2013,2013,2,8, 2 ,4758,900,834,6492
2/8/2013,2013,2,8, 3 ,4642,876,817,6335
2/8/2013,2013,2,8, 4 ,4583,870,807,6260
2/8/2013,2013,2,8, 5 ,4710,897,846,6453
2/8/2013,2013,2,8, 6 ,4935,946,894,6775
2/8/2013,2013,2,8, 7 ,4911,910,833,6654
2/8/2013,2013,2,8, 8 ,5486,1010,911,7407
2/8/2013,2013,2,8, 9 ,6200,1202,1102,8504
2/8/2013,2013,2,8, 10 ,6813,1312,1176,9301
2/8/2013,2013,2,8, 11 ,7058,1380,1209,9647
2/8/2013,2013,2,8, 12 ,6883,1344,1196,9423
2/8/2013,2013,2,8, 13 ,6879,1327,1186,9392
2/8/2013,2013,2,8, 14 ,7194,1385,1199,9778
2/8/2013,2013,2,8, 15 ,7026,1362,1180,9568
2/8/2013,2013,2,8, 16 ,6987,1339,1193,9519
2/8/2013,2013,2,8, 17 ,6592,1244,1151,8987
2/8/2013,2013,2,8, 18 ,6564,1317,1189,9070
2/8/2013,2013,2,8, 19 ,6912,1430,1202,9544
2/8/2013,2013,2,8, 20 ,6697,1357,1193,9247
2/8/2013,2013,2,8, 21 ,6481,1287,1191,8959
2/8/2013,2013,2,8, 22 ,6119,1186,1091,8396
2/8/2013,2013,2,8, 23 ,5678,1063,985,7726
2/8/2013,2013,2,8, 24 ,5278,984,892,7154
2/9/2013,2013,2,9, 1 ,4944,933,846,6723
2/9/2013,2013,2,9, 2 ,4792,902,825,6519
2/9/2013,2013,2,9, 3 ,4633,884,805,6322
2/9/2013,2013,2,9, 4 ,4563,867,797,6227
2/9/2013,2013,2,9, 5 ,4571,882,815,6268
2/9/2013,2013,2,9, 6 ,4667,898,839,6404
2/9/2013,2013,2,9, 7 ,4677,902,828,6407
2/9/2013,2013,2,9, 8 ,5084,971,889,6944
2/9/2013,2013,2,9, 9 ,5577,1116,988,7681
2/9/2013,2013,2,9, 10 ,6108,1198,1075,8381
2/9/2013,2013,2,9, 11 ,6315,1244,1118,8677
2/9/2013,2013,2,9, 12 ,6218,1210,1095,8523
2/9/2013,2013,2,9, 13 ,6074,1206,1096,8376
2/9/2013,2013,2,9, 14 ,6202,1247,1100,8549
2/9/2013,2013,2,9, 15 ,6058,1212,1083,8353
2/9/2013,2013,2,9, 16 ,5901,1181,1052,8134
2/9/2013,2013,2,9, 17 ,5745,1135,1025,7905
2/9/2013,2013,2,9, 18 ,5875,1244,1140,8259
2/9/2013,2013,2,9, 19 ,6290,1351,1159,8800
2/9/2013,2013,2,9, 20 ,6158,1301,1121,8580
2/9/2013,2013,2,9, 21 ,5999,1229,1091,8319
2/9/2013,2013,2,9, 22 ,5609,1114,1028,7751
2/9/2013,2013,2,9, 23 ,5293,1024,966,7283
2/9/2013,2013,2,9, 24 ,4975,960,877,6812
2/10/2013,2013,2,10, 1 ,4660,909,830,6399
2/10/2013,2013,2,10, 2 ,4529,874,793,6196
2/10/2013,2013,2,10, 3 ,4397,844,764,6005
2/10/2013,2013,2,10, 4 ,4304,825,747,5876
2/10/2013,2013,2,10, 5 ,4194,837,758,5789
2/10/2013,2013,2,10, 6 ,4225,830,778,5833
2/10/2013,2013,2,10, 7 ,4107,821,759,5687
2/10/2013,2013,2,10, 8 ,4409,854,782,6045
2/10/2013,2013,2,10, 9 ,4749,930,850,6529
2/10/2013,2013,2,10, 10 ,5164,1005,915,7084
2/10/2013,2013,2,10, 11 ,5441,1040,961,7442
2/10/2013,2013,2,10, 12 ,5399,1044,960,7403
2/10/2013,2013,2,10, 13 ,5411,1047,965,7423
2/10/2013,2013,2,10, 14 ,5474,1058,1000,7532
2/10/2013,2013,2,10, 15 ,5424,1048,999,7471
2/10/2013,2013,2,10, 16 ,5244,1027,978,7249
2/10/2013,2013,2,10, 17 ,5111,1005,947,7063
2/10/2013,2013,2,10, 18 ,5373,1142,1081,7596
2/10/2013,2013,2,10, 19 ,5964,1282,1124,8370
2/10/2013,2013,2,10, 20 ,5921,1237,1102,8260
2/10/2013,2013,2,10, 21 ,5681,1175,1056,7912
2/10/2013,2013,2,10, 22 ,5309,1085,988,7382
2/10/2013,2013,2,10, 23 ,5005,988,900,6893
2/10/2013,2013,2,10, 24 ,4672,919,822,6413
2/11/2013,2013,2,11, 1 ,4373,863,766,6002
2/11/2013,2013,2,11, 2 ,4232,841,736,5809
2/11/2013,2013,2,11, 3 ,4115,822,708,5645
2/11/2013,2013,2,11, 4 ,4043,809,703,5555
2/11/2013,2013,2,11, 5 ,4190,845,767,5802
2/11/2013,2013,2,11, 6 ,4549,899,817,6265
2/11/2013,2013,2,11, 7 ,4660,883,767,6310
2/11/2013,2013,2,11, 8 ,5269,974,864,7107
2/11/2013,2013,2,11, 9 ,6103,1140,1011,8254
2/11/2013,2013,2,11, 10 ,6629,1231,1051,8911
2/11/2013,2013,2,11, 11 ,6925,1276,1129,9330
2/11/2013,2013,2,11, 12 ,6814,1250,1120,9184
2/11/2013,2013,2,11, 13 ,6775,1235,1112,9122
2/11/2013,2013,2,11, 14 ,6992,1288,1144,9424
2/11/2013,2013,2,11, 15 ,6869,1269,1148,9286
2/11/2013,2013,2,11, 16 ,6769,1252,1132,9153
2/11/2013,2013,2,11, 17 ,6517,1240,1091,8848
2/11/2013,2013,2,11, 18 ,6342,1309,1161,8812
2/11/2013,2013,2,11, 19 ,6759,1376,1145,9280
2/11/2013,2013,2,11, 20 ,6577,1319,1136,9032
2/11/2013,2013,2,11, 21 ,6329,1249,1123,8701
2/11/2013,2013,2,11, 22 ,5935,1115,1036,8086
2/11/2013,2013,2,11, 23 ,5454,1001,940,7395
2/11/2013,2013,2,11, 24 ,5080,915,868,6863
2/12/2013,2013,2,12, 1 ,4908,882,836,6626
2/12/2013,2013,2,12, 2 ,4791,863,808,6462
2/12/2013,2013,2,12, 3 ,4581,845,766,6192
2/12/2013,2013,2,12, 4 ,4562,840,767,6169
2/12/2013,2013,2,12, 5 ,4776,882,805,6463
2/12/2013,2013,2,12, 6 ,4945,940,875,6760
2/12/2013,2013,2,12, 7 ,4973,893,810,6676
2/12/2013,2013,2,12, 8 ,5522,990,895,7407
2/12/2013,2013,2,12, 9 ,6283,1185,1030,8498
2/12/2013,2013,2,12, 10 ,6716,1289,1112,9117
2/12/2013,2013,2,12, 11 ,6954,1342,1167,9463
2/12/2013,2013,2,12, 12 ,6836,1280,1136,9252
2/12/2013,2013,2,12, 13 ,6782,1276,1132,9190
2/12/2013,2013,2,12, 14 ,7035,1320,1142,9497
2/12/2013,2013,2,12, 15 ,6903,1284,1139,9326
2/12/2013,2013,2,12, 16 ,6793,1284,1130,9207
2/12/2013,2013,2,12, 17 ,6500,1246,1106,8852
2/12/2013,2013,2,12, 18 ,6437,1318,1171,8926
2/12/2013,2013,2,12, 19 ,6766,1410,1162,9338
2/12/2013,2013,2,12, 20 ,6551,1347,1183,9081
2/12/2013,2013,2,12, 21 ,6336,1256,1148,8740
2/12/2013,2013,2,12, 22 ,5925,1147,1086,8158
2/12/2013,2013,2,12, 23 ,5434,1029,955,7418
2/12/2013,2013,2,12, 24 ,5115,949,866,6930
2/13/2013,2013,2,13, 1 ,4835,905,862,6602
2/13/2013,2013,2,13, 2 ,4680,877,813,6370
2/13/2013,2013,2,13, 3 ,4540,853,793,6186
2/13/2013,2013,2,13, 4 ,4480,845,809,6134
2/13/2013,2013,2,13, 5 ,4669,894,841,6404
2/13/2013,2013,2,13, 6 ,4950,946,885,6781
2/13/2013,2013,2,13, 7 ,4880,901,827,6608
2/13/2013,2013,2,13, 8 ,5490,999,931,7420
2/13/2013,2013,2,13, 9 ,6198,1195,1062,8455
2/13/2013,2013,2,13, 10 ,6631,1289,1119,9039
2/13/2013,2013,2,13, 11 ,6906,1361,1151,9418
2/13/2013,2013,2,13, 12 ,6792,1304,1126,9222
2/13/2013,2013,2,13, 13 ,6725,1303,1135,9163
2/13/2013,2013,2,13, 14 ,7006,1351,1173,9530
2/13/2013,2013,2,13, 15 ,6932,1343,1158,9433
2/13/2013,2013,2,13, 16 ,6824,1321,1153,9298
2/13/2013,2013,2,13, 17 ,6507,1240,1125,8872
2/13/2013,2013,2,13, 18 ,6394,1321,1161,8876
2/13/2013,2013,2,13, 19 ,6758,1405,1174,9337
2/13/2013,2013,2,13, 20 ,6606,1365,1155,9126
2/13/2013,2013,2,13, 21 ,6368,1303,1125,8796
2/13/2013,2013,2,13, 22 ,5999,1183,1067,8249
2/13/2013,2013,2,13, 23 ,5477,1061,971,7509
2/13/2013,2013,2,13, 24 ,5209,965,916,7090
2/14/2013,2013,2,14, 1 ,4864,934,813,6611
2/14/2013,2013,2,14, 2 ,4740,892,817,6449
2/14/2013,2013,2,14, 3 ,4605,872,795,6272
2/14/2013,2013,2,14, 4 ,4550,863,805,6218
2/14/2013,2013,2,14, 5 ,4702,898,839,6439
2/14/2013,2013,2,14, 6 ,4926,955,884,6765
2/14/2013,2013,2,14, 7 ,4969,919,839,6727
2/14/2013,2013,2,14, 8 ,5555,1021,927,7503
2/14/2013,2013,2,14, 9 ,6234,1211,1064,8509
2/14/2013,2013,2,14, 10 ,6673,1306,1124,9103
2/14/2013,2013,2,14, 11 ,6975,1354,1157,9486
2/14/2013,2013,2,14, 12 ,6802,1322,1142,9266
2/14/2013,2013,2,14, 13 ,6840,1323,1151,9314
2/14/2013,2013,2,14, 14 ,7113,1378,1162,9653
2/14/2013,2013,2,14, 15 ,7032,1359,1148,9539
2/14/2013,2013,2,14, 16 ,6891,1334,1142,9367
2/14/2013,2013,2,14, 17 ,6565,1256,1106,8927
2/14/2013,2013,2,14, 18 ,6439,1313,1138,8890
2/14/2013,2013,2,14, 19 ,6778,1427,1137,9342
2/14/2013,2013,2,14, 20 ,6659,1358,1116,9133
2/14/2013,2013,2,14, 21 ,6391,1308,1109,8808
2/14/2013,2013,2,14, 22 ,6105,1191,1061,8357
2/14/2013,2013,2,14, 23 ,5564,1069,964,7597
2/14/2013,2013,2,14, 24 ,5216,985,887,7088
2/15/2013,2013,2,15, 1 ,4969,937,848,6754
2/15/2013,2013,2,15, 2 ,4805,905,828,6538
2/15/2013,2013,2,15, 3 ,4722,890,805,6417
2/15/2013,2013,2,15, 4 ,4718,873,796,6387
2/15/2013,2013,2,15, 5 ,4825,900,825,6550
2/15/2013,2013,2,15, 6 ,4996,948,875,6819
2/15/2013,2013,2,15, 7 ,5056,918,831,6805
2/15/2013,2013,2,15, 8 ,5678,994,905,7577
2/15/2013,2013,2,15, 9 ,6295,1177,992,8464
2/15/2013,2013,2,15, 10 ,6691,1239,1077,9007
2/15/2013,2013,2,15, 11 ,7028,1285,1087,9400
2/15/2013,2013,2,15, 12 ,6934,1267,1079,9280
2/15/2013,2013,2,15, 13 ,6892,1260,1096,9248
2/15/2013,2013,2,15, 14 ,7133,1275,1108,9516
2/15/2013,2013,2,15, 15 ,7058,1266,1110,9434
2/15/2013,2013,2,15, 16 ,6956,1253,1094,9303
2/15/2013,2013,2,15, 17 ,6638,1214,1072,8924
2/15/2013,2013,2,15, 18 ,6436,1292,1122,8850
2/15/2013,2013,2,15, 19 ,6891,1371,1105,9367
2/15/2013,2013,2,15, 20 ,6615,1314,1099,9028
2/15/2013,2013,2,15, 21 ,6458,1243,1101,8802
2/15/2013,2013,2,15, 22 ,6107,1124,1024,8255
2/15/2013,2013,2,15, 23 ,5619,1001,940,7560
2/15/2013,2013,2,15, 24 ,5218,927,892,7037
2/16/2013,2013,2,16, 1 ,4917,888,833,6638
2/16/2013,2013,2,16, 2 ,4792,851,810,6453
2/16/2013,2013,2,16, 3 ,4662,823,788,6273
2/16/2013,2013,2,16, 4 ,4595,824,780,6199
2/16/2013,2013,2,16, 5 ,4611,835,794,6240
2/16/2013,2013,2,16, 6 ,4657,862,819,6338
2/16/2013,2013,2,16, 7 ,4621,858,800,6279
2/16/2013,2013,2,16, 8 ,5078,942,850,6870
2/16/2013,2013,2,16, 9 ,5636,1064,927,7627
2/16/2013,2013,2,16, 10 ,6043,1146,980,8169
2/16/2013,2013,2,16, 11 ,6351,1195,1038,8584
2/16/2013,2013,2,16, 12 ,6191,1181,1014,8386
2/16/2013,2013,2,16, 13 ,6177,1188,964,8329
2/16/2013,2013,2,16, 14 ,6342,1219,1010,8571
2/16/2013,2013,2,16, 15 ,6231,1187,999,8417
2/16/2013,2013,2,16, 16 ,6017,1156,985,8158
2/16/2013,2013,2,16, 17 ,5704,1104,991,7799
2/16/2013,2013,2,16, 18 ,5795,1223,1073,8091
2/16/2013,2013,2,16, 19 ,6374,1337,1055,8766
2/16/2013,2013,2,16, 20 ,6229,1297,1049,8575
2/16/2013,2013,2,16, 21 ,6064,1232,1020,8316
2/16/2013,2013,2,16, 22 ,5835,1116,972,7923
2/16/2013,2013,2,16, 23 ,5384,1015,907,7306
2/16/2013,2013,2,16, 24 ,5062,943,814,6819
2/17/2013,2013,2,17, 1 ,4744,890,776,6410
2/17/2013,2013,2,17, 2 ,4691,864,749,6304
2/17/2013,2013,2,17, 3 ,4535,832,728,6095
2/17/2013,2013,2,17, 4 ,4474,821,716,6011
2/17/2013,2013,2,17, 5 ,4413,826,740,5979
2/17/2013,2013,2,17, 6 ,4386,820,752,5958
2/17/2013,2013,2,17, 7 ,4309,814,745,5868
2/17/2013,2013,2,17, 8 ,4491,833,784,6108
2/17/2013,2013,2,17, 9 ,4817,890,847,6554
2/17/2013,2013,2,17, 10 ,5292,965,902,7159
2/17/2013,2013,2,17, 11 ,5470,1008,933,7411
2/17/2013,2013,2,17, 12 ,5412,1009,938,7359
2/17/2013,2013,2,17, 13 ,5390,1015,937,7342
2/17/2013,2013,2,17, 14 ,5424,1005,938,7367
2/17/2013,2013,2,17, 15 ,5307,1015,921,7243
2/17/2013,2013,2,17, 16 ,5232,997,918,7147
2/17/2013,2013,2,17, 17 ,5128,973,937,7038
2/17/2013,2013,2,17, 18 ,5393,1137,995,7525
2/17/2013,2013,2,17, 19 ,5997,1280,1061,8338
2/17/2013,2013,2,17, 20 ,5907,1252,1055,8214
2/17/2013,2013,2,17, 21 ,5805,1180,1006,7991
2/17/2013,2013,2,17, 22 ,5393,1087,926,7406
2/17/2013,2013,2,17, 23 ,5120,988,874,6982
2/17/2013,2013,2,17, 24 ,4657,909,775,6341
2/18/2013,2013,2,18, 1 ,4476,866,759,6101
2/18/2013,2013,2,18, 2 ,4316,833,736,5885
2/18/2013,2013,2,18, 3 ,4214,822,713,5749
2/18/2013,2013,2,18, 4 ,4198,822,709,5729
2/18/2013,2013,2,18, 5 ,4378,862,752,5992
2/18/2013,2013,2,18, 6 ,4676,927,838,6441
2/18/2013,2013,2,18, 7 ,4689,896,800,6385
2/18/2013,2013,2,18, 8 ,5399,1003,862,7264
2/18/2013,2013,2,18, 9 ,6145,1194,1010,8349
2/18/2013,2013,2,18, 10 ,6719,1288,1057,9064
2/18/2013,2013,2,18, 11 ,7009,1319,1111,9439
2/18/2013,2013,2,18, 12 ,6895,1286,1093,9274
2/18/2013,2013,2,18, 13 ,6873,1273,1075,9221
2/18/2013,2013,2,18, 14 ,7111,1308,1122,9541
2/18/2013,2013,2,18, 15 ,7037,1281,1090,9408
2/18/2013,2013,2,18, 16 ,6867,1264,1117,9248
2/18/2013,2013,2,18, 17 ,6554,1220,1094,8868
2/18/2013,2013,2,18, 18 ,6369,1333,1163,8865
2/18/2013,2013,2,18, 19 ,6759,1407,1133,9299
2/18/2013,2013,2,18, 20 ,6561,1345,1087,8993
2/18/2013,2013,2,18, 21 ,6314,1261,1072,8647
2/18/2013,2013,2,18, 22 ,5972,1146,935,8053
2/18/2013,2013,2,18, 23 ,5435,1034,859,7328
2/18/2013,2013,2,18, 24 ,5109,949,796,6854
2/19/2013,2013,2,19, 1 ,4833,921,756,6510
2/19/2013,2013,2,19, 2 ,4714,896,737,6347
2/19/2013,2013,2,19, 3 ,4571,876,722,6169
2/19/2013,2013,2,19, 4 ,4584,863,726,6173
2/19/2013,2013,2,19, 5 ,4691,898,748,6337
2/19/2013,2013,2,19, 6 ,4884,962,811,6657
2/19/2013,2013,2,19, 7 ,4928,936,865,6729
2/19/2013,2013,2,19, 8 ,5470,1018,893,7381
2/19/2013,2013,2,19, 9 ,6199,1169,1025,8393
2/19/2013,2013,2,19, 10 ,6654,1230,1078,8962
2/19/2013,2013,2,19, 11 ,6940,1262,1098,9300
2/19/2013,2013,2,19, 12 ,6790,1218,1095,9103
2/19/2013,2013,2,19, 13 ,6784,1185,1085,9054
2/19/2013,2013,2,19, 14 ,7043,1216,1116,9375
2/19/2013,2013,2,19, 15 ,6928,1206,1110,9244
2/19/2013,2013,2,19, 16 ,6840,1208,1120,9168
2/19/2013,2013,2,19, 17 ,6561,1211,1097,8869
2/19/2013,2013,2,19, 18 ,6449,1306,1168,8923
2/19/2013,2013,2,19, 19 ,6801,1316,1193,9310
2/19/2013,2013,2,19, 20 ,6577,1237,1152,8966
2/19/2013,2013,2,19, 21 ,6367,1153,1077,8597
2/19/2013,2013,2,19, 22 ,5991,1031,981,8003
2/19/2013,2013,2,19, 23 ,5524,933,881,7338
2/19/2013,2013,2,19, 24 ,5191,857,807,6855
2/20/2013,2013,2,20, 1 ,4910,842,778,6530
2/20/2013,2013,2,20, 2 ,4740,817,754,6311
2/20/2013,2013,2,20, 3 ,4627,803,744,6174
2/20/2013,2013,2,20, 4 ,4621,802,737,6160
2/20/2013,2013,2,20, 5 ,4744,830,779,6353
2/20/2013,2013,2,20, 6 ,5007,916,853,6776
2/20/2013,2013,2,20, 7 ,4996,941,844,6781
2/20/2013,2013,2,20, 8 ,5551,1000,892,7443
2/20/2013,2013,2,20, 9 ,6330,1148,1011,8489
2/20/2013,2013,2,20, 10 ,6692,1200,1117,9009
2/20/2013,2013,2,20, 11 ,6315,1237,1175,8727
2/20/2013,2013,2,20, 12 ,6494,1206,1161,8861
2/20/2013,2013,2,20, 13 ,6516,1191,1137,8844
2/20/2013,2013,2,20, 14 ,6754,1232,1196,9182
2/20/2013,2013,2,20, 15 ,6571,1221,1178,8970
2/20/2013,2013,2,20, 16 ,6560,1229,1160,8949
2/20/2013,2013,2,20, 17 ,6226,1197,1135,8558
2/20/2013,2013,2,20, 18 ,6087,1326,1215,8628
2/20/2013,2013,2,20, 19 ,6541,1346,1243,9130
2/20/2013,2013,2,20, 20 ,6378,1296,1202,8876
2/20/2013,2013,2,20, 21 ,6171,1199,1147,8517
2/20/2013,2013,2,20, 22 ,5818,1087,1006,7911
2/20/2013,2013,2,20, 23 ,5303,966,917,7186
2/20/2013,2013,2,20, 24 ,5015,900,834,6749
2/21/2013,2013,2,21, 1 ,4787,856,780,6423
2/21/2013,2013,2,21, 2 ,4609,830,745,6184
2/21/2013,2013,2,21, 3 ,4524,815,754,6093
2/21/2013,2013,2,21, 4 ,4525,813,749,6087
2/21/2013,2013,2,21, 5 ,4718,859,794,6371
2/21/2013,2013,2,21, 6 ,4970,929,876,6775
2/21/2013,2013,2,21, 7 ,5004,907,832,6743
2/21/2013,2013,2,21, 8 ,5523,990,886,7399
2/21/2013,2013,2,21, 9 ,6140,1178,1022,8340
2/21/2013,2013,2,21, 10 ,6594,1276,1111,8981
2/21/2013,2013,2,21, 11 ,6804,1330,1193,9327
2/21/2013,2013,2,21, 12 ,6657,1303,1190,9150
2/21/2013,2013,2,21, 13 ,6620,1308,1180,9108
2/21/2013,2013,2,21, 14 ,6828,1350,1220,9398
2/21/2013,2013,2,21, 15 ,6755,1330,1214,9299
2/21/2013,2013,2,21, 16 ,6581,1304,1170,9055
2/21/2013,2013,2,21, 17 ,6498,1249,1156,8903
2/21/2013,2013,2,21, 18 ,6528,1326,1233,9087
2/21/2013,2013,2,21, 19 ,6709,1407,1255,9371
2/21/2013,2013,2,21, 20 ,6499,1354,1217,9070
2/21/2013,2013,2,21, 21 ,6290,1274,1172,8736
2/21/2013,2013,2,21, 22 ,5897,1166,1037,8100
2/21/2013,2013,2,21, 23 ,5438,1037,947,7422
2/21/2013,2013,2,21, 24 ,5055,950,873,6878
2/22/2013,2013,2,22, 1 ,4780,911,834,6525
2/22/2013,2013,2,22, 2 ,4633,886,810,6329
2/22/2013,2013,2,22, 3 ,4568,868,789,6225
2/22/2013,2013,2,22, 4 ,4503,862,788,6153
2/22/2013,2013,2,22, 5 ,4649,898,818,6365
2/22/2013,2013,2,22, 6 ,4892,959,863,6714
2/22/2013,2013,2,22, 7 ,5016,930,849,6795
2/22/2013,2013,2,22, 8 ,5512,1014,921,7447
2/22/2013,2013,2,22, 9 ,6037,1185,1047,8269
2/22/2013,2013,2,22, 10 ,6430,1270,1122,8822
2/22/2013,2013,2,22, 11 ,6579,1328,1168,9075
2/22/2013,2013,2,22, 12 ,6291,1310,1141,8742
2/22/2013,2013,2,22, 13 ,6322,1301,1127,8750
2/22/2013,2013,2,22, 14 ,6448,1347,1143,8938
2/22/2013,2013,2,22, 15 ,6411,1316,1131,8858
2/22/2013,2013,2,22, 16 ,6351,1304,1116,8771
2/22/2013,2013,2,22, 17 ,6190,1240,1114,8544
2/22/2013,2013,2,22, 18 ,6236,1314,1178,8728
2/22/2013,2013,2,22, 19 ,6491,1397,1168,9056
2/22/2013,2013,2,22, 20 ,6211,1338,1124,8673
2/22/2013,2013,2,22, 21 ,6020,1288,1102,8410
2/22/2013,2013,2,22, 22 ,5575,1182,961,7718
2/22/2013,2013,2,22, 23 ,5127,1059,888,7074
2/22/2013,2013,2,22, 24 ,4845,985,833,6663
2/23/2013,2013,2,23, 1 ,4608,937,792,6337
2/23/2013,2013,2,23, 2 ,4423,911,769,6103
2/23/2013,2013,2,23, 3 ,4342,886,741,5969
2/23/2013,2013,2,23, 4 ,4258,869,739,5866
2/23/2013,2013,2,23, 5 ,4299,882,756,5937
2/23/2013,2013,2,23, 6 ,4392,912,797,6101
2/23/2013,2013,2,23, 7 ,4550,911,802,6263
2/23/2013,2013,2,23, 8 ,4968,987,839,6794
2/23/2013,2013,2,23, 9 ,5484,1129,945,7558
2/23/2013,2013,2,23, 10 ,6001,1212,1049,8262
2/23/2013,2013,2,23, 11 ,6245,1274,1098,8617
2/23/2013,2013,2,23, 12 ,6108,1249,1091,8448
2/23/2013,2013,2,23, 13 ,6060,1247,1112,8419
2/23/2013,2013,2,23, 14 ,6249,1277,1141,8667
2/23/2013,2013,2,23, 15 ,6177,1239,1111,8527
2/23/2013,2013,2,23, 16 ,5948,1206,1084,8238
2/23/2013,2013,2,23, 17 ,5727,1163,1058,7948
2/23/2013,2013,2,23, 18 ,5773,1234,1148,8155
2/23/2013,2013,2,23, 19 ,6292,1377,1184,8853
2/23/2013,2013,2,23, 20 ,6146,1331,1139,8616
2/23/2013,2013,2,23, 21 ,5987,1274,1118,8379
2/23/2013,2013,2,23, 22 ,5694,1187,1036,7917
2/23/2013,2013,2,23, 23 ,5278,1071,935,7284
2/23/2013,2013,2,23, 24 ,4942,985,843,6770
2/24/2013,2013,2,24, 1 ,4700,930,805,6435
2/24/2013,2013,2,24, 2 ,4556,904,785,6245
2/24/2013,2013,2,24, 3 ,4398,879,762,6039
2/24/2013,2013,2,24, 4 ,4300,859,749,5908
2/24/2013,2013,2,24, 5 ,4285,861,762,5908
2/24/2013,2013,2,24, 6 ,4273,857,778,5908
2/24/2013,2013,2,24, 7 ,4175,840,722,5737
2/24/2013,2013,2,24, 8 ,4371,862,725,5958
2/24/2013,2013,2,24, 9 ,4732,933,824,6489
2/24/2013,2013,2,24, 10 ,5151,1007,866,7024
2/24/2013,2013,2,24, 11 ,5417,1042,923,7382
2/24/2013,2013,2,24, 12 ,5342,1056,921,7319
2/24/2013,2013,2,24, 13 ,5389,1065,944,7398
2/24/2013,2013,2,24, 14 ,5356,1074,951,7381
2/24/2013,2013,2,24, 15 ,5348,1063,933,7344
2/24/2013,2013,2,24, 16 ,5180,1031,920,7131
2/24/2013,2013,2,24, 17 ,5111,1017,864,6992
2/24/2013,2013,2,24, 18 ,5294,1178,997,7469
2/24/2013,2013,2,24, 19 ,5904,1316,1151,8371
2/24/2013,2013,2,24, 20 ,5885,1283,1114,8282
2/24/2013,2013,2,24, 21 ,5657,1203,1076,7936
2/24/2013,2013,2,24, 22 ,5385,1123,994,7502
2/24/2013,2013,2,24, 23 ,5027,1029,882,6938
2/24/2013,2013,2,24, 24 ,4721,957,824,6502
2/25/2013,2013,2,25, 1 ,4504,908,773,6185
2/25/2013,2013,2,25, 2 ,4365,875,736,5976
2/25/2013,2013,2,25, 3 ,4203,853,716,5772
2/25/2013,2013,2,25, 4 ,4182,843,710,5735
2/25/2013,2013,2,25, 5 ,4236,863,728,5827
2/25/2013,2013,2,25, 6 ,4434,893,770,6097
2/25/2013,2013,2,25, 7 ,4698,909,770,6377
2/25/2013,2013,2,25, 8 ,5367,1034,883,7284
2/25/2013,2013,2,25, 9 ,6091,1209,1013,8313
2/25/2013,2013,2,25, 10 ,6593,1261,1099,8953
2/25/2013,2013,2,25, 11 ,6886,1359,1181,9426
2/25/2013,2013,2,25, 12 ,6809,1328,1157,9294
2/25/2013,2013,2,25, 13 ,6757,1323,1175,9255
2/25/2013,2013,2,25, 14 ,6969,1366,1223,9558
2/25/2013,2013,2,25, 15 ,6886,1349,1209,9444
2/25/2013,2013,2,25, 16 ,6746,1330,1173,9249
2/25/2013,2013,2,25, 17 ,6436,1264,1116,8816
2/25/2013,2013,2,25, 18 ,6282,1331,1183,8796
2/25/2013,2013,2,25, 19 ,6690,1429,1230,9349
2/25/2013,2013,2,25, 20 ,6526,1368,1191,9085
2/25/2013,2013,2,25, 21 ,6295,1314,1150,8759
2/25/2013,2013,2,25, 22 ,5991,1192,1045,8228
2/25/2013,2013,2,25, 23 ,5498,1067,959,7524
2/25/2013,2013,2,25, 24 ,5095,989,863,6947
2/26/2013,2013,2,26, 1 ,4859,940,821,6620
2/26/2013,2013,2,26, 2 ,4699,905,800,6404
2/26/2013,2013,2,26, 3 ,4581,883,779,6243
2/26/2013,2013,2,26, 4 ,4554,874,773,6201
2/26/2013,2013,2,26, 5 ,4729,915,785,6429
2/26/2013,2013,2,26, 6 ,4948,966,870,6784
2/26/2013,2013,2,26, 7 ,4955,916,805,6676
2/26/2013,2013,2,26, 8 ,5590,1020,897,7507
2/26/2013,2013,2,26, 9 ,6225,1203,1062,8490
2/26/2013,2013,2,26, 10 ,6670,1291,1115,9076
2/26/2013,2013,2,26, 11 ,6958,1327,1154,9439
2/26/2013,2013,2,26, 12 ,6722,1295,1120,9137
2/26/2013,2013,2,26, 13 ,6834,1282,1147,9263
2/26/2013,2013,2,26, 14 ,6995,1322,1190,9507
2/26/2013,2013,2,26, 15 ,6895,1303,1177,9375
2/26/2013,2013,2,26, 16 ,6792,1273,1158,9223
2/26/2013,2013,2,26, 17 ,6521,1227,1119,8867
2/26/2013,2013,2,26, 18 ,6367,1318,1160,8845
2/26/2013,2013,2,26, 19 ,6845,1405,1178,9428
2/26/2013,2013,2,26, 20 ,6676,1338,1187,9201
2/26/2013,2013,2,26, 21 ,6397,1272,1168,8837
2/26/2013,2013,2,26, 22 ,6047,1137,1077,8261
2/26/2013,2013,2,26, 23 ,5505,1020,980,7505
2/26/2013,2013,2,26, 24 ,5229,951,880,7060
2/27/2013,2013,2,27, 1 ,4908,918,836,6662
2/27/2013,2013,2,27, 2 ,4751,893,800,6444
2/27/2013,2013,2,27, 3 ,4601,874,785,6260
2/27/2013,2013,2,27, 4 ,4600,864,783,6247
2/27/2013,2013,2,27, 5 ,4731,907,831,6469
2/27/2013,2013,2,27, 6 ,4960,964,893,6817
2/27/2013,2013,2,27, 7 ,4909,920,836,6665
2/27/2013,2013,2,27, 8 ,5569,1030,967,7566
2/27/2013,2013,2,27, 9 ,6326,1201,1086,8613
2/27/2013,2013,2,27, 10 ,6896,1295,1145,9336
2/27/2013,2013,2,27, 11 ,7155,1341,1172,9668
2/27/2013,2013,2,27, 12 ,7021,1309,1166,9496
2/27/2013,2013,2,27, 13 ,6928,1312,1172,9412
2/27/2013,2013,2,27, 14 ,7194,1365,1196,9755
2/27/2013,2013,2,27, 15 ,7121,1349,1173,9643
2/27/2013,2013,2,27, 16 ,7007,1333,1182,9522
2/27/2013,2013,2,27, 17 ,6651,1254,1145,9050
2/27/2013,2013,2,27, 18 ,6525,1311,1200,9036
2/27/2013,2013,2,27, 19 ,6951,1438,1233,9622
2/27/2013,2013,2,27, 20 ,6779,1383,1209,9371
2/27/2013,2013,2,27, 21 ,6506,1312,1208,9026
2/27/2013,2013,2,27, 22 ,6195,1185,1117,8497
2/27/2013,2013,2,27, 23 ,5636,1051,1013,7700
2/27/2013,2013,2,27, 24 ,5268,986,921,7175
2/28/2013,2013,2,28, 1 ,4970,938,872,6780
2/28/2013,2013,2,28, 2 ,4868,910,842,6620
2/28/2013,2013,2,28, 3 ,4738,886,825,6449
2/28/2013,2013,2,28, 4 ,4721,881,809,6411
2/28/2013,2013,2,28, 5 ,4772,915,850,6537
2/28/2013,2013,2,28, 6 ,4977,962,885,6824
2/28/2013,2013,2,28, 7 ,4978,909,834,6721
2/28/2013,2013,2,28, 8 ,5568,1020,958,7546
2/28/2013,2013,2,28, 9 ,6350,1213,1087,8650
2/28/2013,2013,2,28, 10 ,6840,1303,1159,9302
2/28/2013,2013,2,28, 11 ,7123,1357,1195,9675
2/28/2013,2013,2,28, 12 ,6969,1324,1167,9460
2/28/2013,2013,2,28, 13 ,6979,1343,1175,9497
2/28/2013,2013,2,28, 14 ,7236,1376,1191,9803
2/28/2013,2013,2,28, 15 ,7137,1352,1194,9683
2/28/2013,2013,2,28, 16 ,7033,1312,1190,9535
2/28/2013,2013,2,28, 17 ,6747,1235,1158,9140
2/28/2013,2013,2,28, 18 ,6489,1279,1202,8970
2/28/2013,2013,2,28, 19 ,6922,1403,1205,9530
2/28/2013,2013,2,28, 20 ,6759,1362,1186,9307
2/28/2013,2013,2,28, 21 ,6566,1293,1159,9018
2/28/2013,2013,2,28, 22 ,6190,1165,1101,8456
2/28/2013,2013,2,28, 23 ,5689,1047,989,7725
2/28/2013,2013,2,28, 24 ,5326,970,917,7213
3/1/2013,2013,3,1, 1 ,5031,917,868,6816
3/1/2013,2013,3,1, 2 ,4922,889,843,6654
3/1/2013,2013,3,1, 3 ,4725,869,810,6404
3/1/2013,2013,3,1, 4 ,4662,861,801,6324
3/1/2013,2013,3,1, 5 ,4709,897,842,6448
3/1/2013,2013,3,1, 6 ,4973,926,880,6779
3/1/2013,2013,3,1, 7 ,4920,889,815,6624
3/1/2013,2013,3,1, 8 ,5554,992,922,7468
3/1/2013,2013,3,1, 9 ,6304,1188,1033,8525
3/1/2013,2013,3,1, 10 ,6790,1278,1082,9150
3/1/2013,2013,3,1, 11 ,7062,1331,1091,9484
3/1/2013,2013,3,1, 12 ,6998,1308,1114,9420
3/1/2013,2013,3,1, 13 ,6957,1325,1127,9409
3/1/2013,2013,3,1, 14 ,7182,1376,1146,9704
3/1/2013,2013,3,1, 15 ,7122,1350,1132,9604
3/1/2013,2013,3,1, 16 ,6961,1327,1123,9411
3/1/2013,2013,3,1, 17 ,6657,1230,1096,8983
3/1/2013,2013,3,1, 18 ,6472,1274,1158,8904
3/1/2013,2013,3,1, 19 ,6862,1416,1158,9436
3/1/2013,2013,3,1, 20 ,6741,1376,1144,9261
3/1/2013,2013,3,1, 21 ,6481,1306,1156,8943
3/1/2013,2013,3,1, 22 ,6188,1192,1102,8482
3/1/2013,2013,3,1, 23 ,5752,1073,1007,7832
3/1/2013,2013,3,1, 24 ,5344,994,939,7277
3/2/2013,2013,3,2, 1 ,5045,936,884,6865
3/2/2013,2013,3,2, 2 ,4881,908,846,6635
3/2/2013,2013,3,2, 3 ,4669,889,817,6375
3/2/2013,2013,3,2, 4 ,4550,886,812,6248
3/2/2013,2013,3,2, 5 ,4548,888,827,6263
3/2/2013,2013,3,2, 6 ,4625,903,847,6375
3/2/2013,2013,3,2, 7 ,4656,906,816,6378
3/2/2013,2013,3,2, 8 ,5112,989,856,6957
3/2/2013,2013,3,2, 9 ,5674,1128,994,7796
3/2/2013,2013,3,2, 10 ,6177,1216,1057,8450
3/2/2013,2013,3,2, 11 ,6530,1288,1091,8909
3/2/2013,2013,3,2, 12 ,6395,1269,1079,8743
3/2/2013,2013,3,2, 13 ,6404,1276,1090,8770
3/2/2013,2013,3,2, 14 ,6560,1302,1122,8984
3/2/2013,2013,3,2, 15 ,6471,1282,1104,8857
3/2/2013,2013,3,2, 16 ,6272,1237,1072,8581
3/2/2013,2013,3,2, 17 ,6041,1179,1049,8269
3/2/2013,2013,3,2, 18 ,6023,1253,1145,8421
3/2/2013,2013,3,2, 19 ,6567,1396,1182,9145
3/2/2013,2013,3,2, 20 ,6392,1345,1155,8892
3/2/2013,2013,3,2, 21 ,6277,1309,1168,8754
3/2/2013,2013,3,2, 22 ,6059,1216,1105,8380
3/2/2013,2013,3,2, 23 ,5635,1107,999,7741
3/2/2013,2013,3,2, 24 ,5325,1017,920,7262
3/3/2013,2013,3,3, 1 ,4995,964,864,6823
3/3/2013,2013,3,3, 2 ,4834,927,838,6599
3/3/2013,2013,3,3, 3 ,4673,896,808,6377
3/3/2013,2013,3,3, 4 ,4566,882,806,6254
3/3/2013,2013,3,3, 5 ,4551,885,805,6241
3/3/2013,2013,3,3, 6 ,4517,871,813,6201
3/3/2013,2013,3,3, 7 ,4342,853,792,5987
3/3/2013,2013,3,3, 8 ,4516,894,812,6222
3/3/2013,2013,3,3, 9 ,4821,974,894,6689
3/3/2013,2013,3,3, 10 ,5220,1048,966,7234
3/3/2013,2013,3,3, 11 ,5481,1091,1001,7573
3/3/2013,2013,3,3, 12 ,5420,1095,972,7487
3/3/2013,2013,3,3, 13 ,5287,1088,986,7361
3/3/2013,2013,3,3, 14 ,5271,1094,988,7353
3/3/2013,2013,3,3, 15 ,5199,1078,974,7251
3/3/2013,2013,3,3, 16 ,5073,1033,946,7052
3/3/2013,2013,3,3, 17 ,5067,1047,908,7022
3/3/2013,2013,3,3, 18 ,5409,1154,1056,7619
3/3/2013,2013,3,3, 19 ,5932,1330,1125,8387
3/3/2013,2013,3,3, 20 ,5829,1308,1125,8262
3/3/2013,2013,3,3, 21 ,5667,1241,1084,7992
3/3/2013,2013,3,3, 22 ,5352,1133,1000,7485
3/3/2013,2013,3,3, 23 ,4994,1040,903,6937
3/3/2013,2013,3,3, 24 ,4672,959,837,6468
3/4/2013,2013,3,4, 1 ,4400,910,784,6094
3/4/2013,2013,3,4, 2 ,4224,877,760,5861
3/4/2013,2013,3,4, 3 ,4171,849,744,5764
3/4/2013,2013,3,4, 4 ,4117,838,749,5704
3/4/2013,2013,3,4, 5 ,4319,881,790,5990
3/4/2013,2013,3,4, 6 ,4635,931,855,6421
3/4/2013,2013,3,4, 7 ,4714,893,811,6418
3/4/2013,2013,3,4, 8 ,5415,1013,892,7320
3/4/2013,2013,3,4, 9 ,6127,1222,976,8325
3/4/2013,2013,3,4, 10 ,6573,1324,1086,8983
3/4/2013,2013,3,4, 11 ,6830,1372,1116,9318
3/4/2013,2013,3,4, 12 ,6715,1353,1093,9161
3/4/2013,2013,3,4, 13 ,6654,1318,1114,9086
3/4/2013,2013,3,4, 14 ,6747,1362,1118,9227
3/4/2013,2013,3,4, 15 ,6758,1339,1101,9198
3/4/2013,2013,3,4, 16 ,6670,1324,1090,9084
3/4/2013,2013,3,4, 17 ,6315,1259,1094,8668
3/4/2013,2013,3,4, 18 ,6267,1308,1127,8702
3/4/2013,2013,3,4, 19 ,6592,1429,1124,9145
3/4/2013,2013,3,4, 20 ,6434,1371,1107,8912
3/4/2013,2013,3,4, 21 ,6177,1297,1111,8585
3/4/2013,2013,3,4, 22 ,5753,1174,1004,7931
3/4/2013,2013,3,4, 23 ,5289,1056,944,7289
3/4/2013,2013,3,4, 24 ,4955,984,869,6808
3/5/2013,2013,3,5, 1 ,4712,940,832,6484
3/5/2013,2013,3,5, 2 ,4560,905,807,6272
3/5/2013,2013,3,5, 3 ,4474,888,789,6151
3/5/2013,2013,3,5, 4 ,4404,880,787,6071
3/5/2013,2013,3,5, 5 ,4625,925,836,6386
3/5/2013,2013,3,5, 6 ,4866,971,893,6730
3/5/2013,2013,3,5, 7 ,4905,912,844,6661
3/5/2013,2013,3,5, 8 ,5482,1030,941,7453
3/5/2013,2013,3,5, 9 ,6178,1206,1039,8423
3/5/2013,2013,3,5, 10 ,6596,1303,1124,9023
3/5/2013,2013,3,5, 11 ,6836,1349,1137,9322
3/5/2013,2013,3,5, 12 ,6698,1320,1073,9091
3/5/2013,2013,3,5, 13 ,6593,1306,1081,8980
3/5/2013,2013,3,5, 14 ,6867,1367,1123,9357
3/5/2013,2013,3,5, 15 ,6726,1331,1103,9160
3/5/2013,2013,3,5, 16 ,6647,1313,1093,9053
3/5/2013,2013,3,5, 17 ,6369,1253,1066,8688
3/5/2013,2013,3,5, 18 ,6294,1326,1139,8759
3/5/2013,2013,3,5, 19 ,6667,1421,1102,9190
3/5/2013,2013,3,5, 20 ,6469,1365,1106,8940
3/5/2013,2013,3,5, 21 ,6075,1277,1110,8462
3/5/2013,2013,3,5, 22 ,5768,1161,1016,7945
3/5/2013,2013,3,5, 23 ,5317,1038,975,7330
3/5/2013,2013,3,5, 24 ,4926,978,911,6815
3/6/2013,2013,3,6, 1 ,4699,928,857,6484
3/6/2013,2013,3,6, 2 ,4611,896,831,6338
3/6/2013,2013,3,6, 3 ,4439,881,810,6130
3/6/2013,2013,3,6, 4 ,4401,871,815,6087
3/6/2013,2013,3,6, 5 ,4604,909,850,6363
3/6/2013,2013,3,6, 6 ,4769,949,905,6623
3/6/2013,2013,3,6, 7 ,4812,916,852,6580
3/6/2013,2013,3,6, 8 ,5437,1042,959,7438
3/6/2013,2013,3,6, 9 ,6045,1228,1075,8348
3/6/2013,2013,3,6, 10 ,6581,1327,1144,9052
3/6/2013,2013,3,6, 11 ,6840,1385,1146,9371
3/6/2013,2013,3,6, 12 ,6713,1344,1119,9176
3/6/2013,2013,3,6, 13 ,6725,1345,1116,9186
3/6/2013,2013,3,6, 14 ,6922,1397,1162,9481
3/6/2013,2013,3,6, 15 ,6870,1373,1112,9355
3/6/2013,2013,3,6, 16 ,6689,1357,1091,9137
3/6/2013,2013,3,6, 17 ,6397,1273,1060,8730
3/6/2013,2013,3,6, 18 ,6340,1344,1133,8817
3/6/2013,2013,3,6, 19 ,6684,1453,1118,9255
3/6/2013,2013,3,6, 20 ,6448,1394,1134,8976
3/6/2013,2013,3,6, 21 ,6208,1325,1135,8668
3/6/2013,2013,3,6, 22 ,5785,1194,1069,8048
3/6/2013,2013,3,6, 23 ,5363,1077,971,7411
3/6/2013,2013,3,6, 24 ,4937,995,917,6849
3/7/2013,2013,3,7, 1 ,4732,959,878,6569
3/7/2013,2013,3,7, 2 ,4612,948,851,6411
3/7/2013,2013,3,7, 3 ,4456,910,830,6196
3/7/2013,2013,3,7, 4 ,4451,899,839,6189
3/7/2013,2013,3,7, 5 ,4587,933,866,6386
3/7/2013,2013,3,7, 6 ,4812,974,920,6706
3/7/2013,2013,3,7, 7 ,4894,928,855,6677
3/7/2013,2013,3,7, 8 ,5485,1036,956,7477
3/7/2013,2013,3,7, 9 ,6098,1238,1069,8405
3/7/2013,2013,3,7, 10 ,6502,1342,1129,8973
3/7/2013,2013,3,7, 11 ,6796,1358,1146,9300
3/7/2013,2013,3,7, 12 ,6708,1356,1116,9180
3/7/2013,2013,3,7, 13 ,6602,1326,1128,9056
3/7/2013,2013,3,7, 14 ,6853,1397,1131,9381
3/7/2013,2013,3,7, 15 ,6769,1373,1115,9257
3/7/2013,2013,3,7, 16 ,6615,1374,1106,9095
3/7/2013,2013,3,7, 17 ,6299,1298,1092,8689
3/7/2013,2013,3,7, 18 ,6336,1369,1131,8836
3/7/2013,2013,3,7, 19 ,6750,1477,1088,9315
3/7/2013,2013,3,7, 20 ,6523,1415,1095,9033
3/7/2013,2013,3,7, 21 ,6286,1335,1083,8704
3/7/2013,2013,3,7, 22 ,5994,1211,1051,8256
3/7/2013,2013,3,7, 23 ,5518,1100,964,7582
3/7/2013,2013,3,7, 24 ,5124,1022,921,7067
3/8/2013,2013,3,8, 1 ,4843,973,869,6685
3/8/2013,2013,3,8, 2 ,4760,942,850,6552
3/8/2013,2013,3,8, 3 ,4598,917,816,6331
3/8/2013,2013,3,8, 4 ,4576,906,816,6298
3/8/2013,2013,3,8, 5 ,4685,946,854,6485
3/8/2013,2013,3,8, 6 ,4929,991,883,6803
3/8/2013,2013,3,8, 7 ,4957,948,837,6742
3/8/2013,2013,3,8, 8 ,5595,1061,908,7564
3/8/2013,2013,3,8, 9 ,6078,1248,1055,8381
3/8/2013,2013,3,8, 10 ,6645,1324,1094,9063
3/8/2013,2013,3,8, 11 ,6876,1369,1134,9379
3/8/2013,2013,3,8, 12 ,6743,1342,1107,9192
3/8/2013,2013,3,8, 13 ,6723,1329,1128,9180
3/8/2013,2013,3,8, 14 ,6891,1366,1124,9381
3/8/2013,2013,3,8, 15 ,6794,1333,1113,9240
3/8/2013,2013,3,8, 16 ,6662,1314,1098,9074
3/8/2013,2013,3,8, 17 ,6405,1265,1063,8733
3/8/2013,2013,3,8, 18 ,6306,1337,1144,8787
3/8/2013,2013,3,8, 19 ,6709,1418,1114,9241
3/8/2013,2013,3,8, 20 ,6527,1357,1120,9004
3/8/2013,2013,3,8, 21 ,6283,1273,1091,8647
3/8/2013,2013,3,8, 22 ,5948,1153,1052,8153
3/8/2013,2013,3,8, 23 ,5440,1049,984,7473
3/8/2013,2013,3,8, 24 ,5112,975,909,6996
3/9/2013,2013,3,9, 1 ,4848,936,867,6651
3/9/2013,2013,3,9, 2 ,4718,908,862,6488
3/9/2013,2013,3,9, 3 ,4596,887,834,6317
3/9/2013,2013,3,9, 4 ,4498,876,827,6201
3/9/2013,2013,3,9, 5 ,4539,891,853,6283
3/9/2013,2013,3,9, 6 ,4648,912,877,6437
3/9/2013,2013,3,9, 7 ,4696,920,848,6464
3/9/2013,2013,3,9, 8 ,5146,990,910,7046
3/9/2013,2013,3,9, 9 ,5604,1121,1003,7728
3/9/2013,2013,3,9, 10 ,6162,1197,1081,8440
3/9/2013,2013,3,9, 11 ,6469,1254,1101,8824
3/9/2013,2013,3,9, 12 ,6304,1232,1072,8608
3/9/2013,2013,3,9, 13 ,6329,1236,1111,8676
3/9/2013,2013,3,9, 14 ,6502,1269,1113,8884
3/9/2013,2013,3,9, 15 ,6343,1239,1083,8665
3/9/2013,2013,3,9, 16 ,6133,1220,1063,8416
3/9/2013,2013,3,9, 17 ,5959,1190,1076,8225
3/9/2013,2013,3,9, 18 ,6103,1285,1150,8538
3/9/2013,2013,3,9, 19 ,6484,1395,1128,9007
3/9/2013,2013,3,9, 20 ,6398,1352,1118,8868
3/9/2013,2013,3,9, 21 ,6262,1301,1103,8666
3/9/2013,2013,3,9, 22 ,6012,1206,1070,8288
3/9/2013,2013,3,9, 23 ,5584,1089,964,7637
3/9/2013,2013,3,9, 24 ,5233,1017,912,7162
3/10/2013,2013,3,10, 1 ,4959,968,868,6795
3/10/2013,2013,3,10, 2 ,4791,936,840,6567
3/10/2013,2013,3,10, 3 ,4647,906,805,6358
3/10/2013,2013,3,10, 4 ,4609,887,788,6284
3/10/2013,2013,3,10, 5 ,4602,896,808,6306
3/10/2013,2013,3,10, 6 ,4525,879,819,6223
3/10/2013,2013,3,10, 7 ,4489,876,793,6158
3/10/2013,2013,3,10, 8 ,4631,910,832,6373
3/10/2013,2013,3,10, 9 ,4982,971,908,6861
3/10/2013,2013,3,10, 10 ,5414,1035,968,7417
3/10/2013,2013,3,10, 11 ,5672,1082,988,7742
3/10/2013,2013,3,10, 12 ,5670,1072,1004,7746
3/10/2013,2013,3,10, 13 ,5632,1083,1006,7721
3/10/2013,2013,3,10, 14 ,5706,1104,1010,7820
3/10/2013,2013,3,10, 15 ,5673,1094,998,7765
3/10/2013,2013,3,10, 16 ,5526,1049,984,7559
3/10/2013,2013,3,10, 17 ,5476,1082,980,7538
3/10/2013,2013,3,10, 18 ,5747,1207,1072,8026
3/10/2013,2013,3,10, 19 ,6280,1328,1088,8696
3/10/2013,2013,3,10, 20 ,6377,1303,1077,8757
3/10/2013,2013,3,10, 21 ,6208,1249,1075,8532
3/10/2013,2013,3,10, 22 ,5960,1152,1030,8142
3/10/2013,2013,3,10, 23 ,5502,1055,942,7499
3/10/2013,2013,3,10, 24 ,5168,975,865,7008
3/11/2013,2013,3,11, 1 ,4868,923,826,6617
3/11/2013,2013,3,11, 2 ,4691,891,799,6381
3/11/2013,2013,3,11, 3 ,4604,870,771,6245
3/11/2013,2013,3,11, 4 ,4572,860,758,6190
3/11/2013,2013,3,11, 5 ,4692,897,795,6384
3/11/2013,2013,3,11, 6 ,4930,954,848,6732
3/11/2013,2013,3,11, 7 ,5016,915,803,6734
3/11/2013,2013,3,11, 8 ,5804,1050,921,7775
3/11/2013,2013,3,11, 9 ,6593,1243,1047,8883
3/11/2013,2013,3,11, 10 ,7101,1342,1133,9576
3/11/2013,2013,3,11, 11 ,7137,1409,1134,9680
3/11/2013,2013,3,11, 12 ,7172,1377,1114,9663
3/11/2013,2013,3,11, 13 ,7297,1383,1120,9800
3/11/2013,2013,3,11, 14 ,7422,1441,1130,9993
3/11/2013,2013,3,11, 15 ,7312,1423,1129,9864
3/11/2013,2013,3,11, 16 ,7278,1391,1125,9794
3/11/2013,2013,3,11, 17 ,6888,1319,1096,9303
3/11/2013,2013,3,11, 18 ,6683,1354,1133,9170
3/11/2013,2013,3,11, 19 ,7077,1480,1141,9698
3/11/2013,2013,3,11, 20 ,6921,1425,1139,9485
3/11/2013,2013,3,11, 21 ,6738,1373,1155,9266
3/11/2013,2013,3,11, 22 ,6384,1230,1111,8725
3/11/2013,2013,3,11, 23 ,5983,1119,997,8099
3/11/2013,2013,3,11, 24 ,5599,1042,931,7572
3/12/2013,2013,3,12, 1 ,5354,997,876,7227
3/12/2013,2013,3,12, 2 ,5135,960,849,6944
3/12/2013,2013,3,12, 3 ,4999,935,825,6759
3/12/2013,2013,3,12, 4 ,4988,929,816,6733
3/12/2013,2013,3,12, 5 ,5010,964,843,6817
3/12/2013,2013,3,12, 6 ,5180,995,893,7068
3/12/2013,2013,3,12, 7 ,5212,962,841,7015
3/12/2013,2013,3,12, 8 ,5980,1054,934,7968
3/12/2013,2013,3,12, 9 ,6714,1280,1072,9066
3/12/2013,2013,3,12, 10 ,7179,1367,1127,9673
3/12/2013,2013,3,12, 11 ,7430,1431,1151,10012
3/12/2013,2013,3,12, 12 ,7294,1405,1124,9823
3/12/2013,2013,3,12, 13 ,7296,1388,1142,9826
3/12/2013,2013,3,12, 14 ,7551,1435,1125,10111
3/12/2013,2013,3,12, 15 ,7467,1411,1110,9988
3/12/2013,2013,3,12, 16 ,7268,1373,1095,9736
3/12/2013,2013,3,12, 17 ,6985,1310,1102,9397
3/12/2013,2013,3,12, 18 ,6800,1366,1145,9311
3/12/2013,2013,3,12, 19 ,7192,1444,1130,9766
3/12/2013,2013,3,12, 20 ,6942,1393,1121,9456
3/12/2013,2013,3,12, 21 ,6756,1339,1129,9224
3/12/2013,2013,3,12, 22 ,6464,1219,1078,8761
3/12/2013,2013,3,12, 23 ,6028,1104,1001,8133
3/12/2013,2013,3,12, 24 ,5683,1018,934,7635
3/13/2013,2013,3,13, 1 ,5407,979,881,7267
3/13/2013,2013,3,13, 2 ,5252,949,853,7054
3/13/2013,2013,3,13, 3 ,5052,921,826,6799
3/13/2013,2013,3,13, 4 ,4966,909,821,6696
3/13/2013,2013,3,13, 5 ,5013,941,862,6816
3/13/2013,2013,3,13, 6 ,5162,977,890,7029
3/13/2013,2013,3,13, 7 ,5226,952,849,7027
3/13/2013,2013,3,13, 8 ,5964,1095,939,7998
3/13/2013,2013,3,13, 9 ,6740,1285,1048,9073
3/13/2013,2013,3,13, 10 ,7188,1374,1100,9662
3/13/2013,2013,3,13, 11 ,7512,1440,1102,10054
3/13/2013,2013,3,13, 12 ,7385,1411,1075,9871
3/13/2013,2013,3,13, 13 ,7380,1418,1122,9920
3/13/2013,2013,3,13, 14 ,7653,1463,1141,10257
3/13/2013,2013,3,13, 15 ,7525,1433,1109,10067
3/13/2013,2013,3,13, 16 ,7394,1412,1108,9914
3/13/2013,2013,3,13, 17 ,7013,1323,1091,9427
3/13/2013,2013,3,13, 18 ,6856,1344,1127,9327
3/13/2013,2013,3,13, 19 ,7174,1483,1117,9774
3/13/2013,2013,3,13, 20 ,7050,1428,1117,9595
3/13/2013,2013,3,13, 21 ,6885,1366,1127,9378
3/13/2013,2013,3,13, 22 ,6529,1246,1059,8834
3/13/2013,2013,3,13, 23 ,6151,1129,995,8275
3/13/2013,2013,3,13, 24 ,5751,1051,937,7739
3/14/2013,2013,3,14, 1 ,5474,997,896,7367
3/14/2013,2013,3,14, 2 ,5295,973,864,7132
3/14/2013,2013,3,14, 3 ,5150,943,833,6926
3/14/2013,2013,3,14, 4 ,5081,931,831,6843
3/14/2013,2013,3,14, 5 ,5187,955,861,7003
3/14/2013,2013,3,14, 6 ,5274,989,915,7178
3/14/2013,2013,3,14, 7 ,5344,961,866,7171
3/14/2013,2013,3,14, 8 ,6071,1093,983,8147
3/14/2013,2013,3,14, 9 ,6827,1286,1072,9185
3/14/2013,2013,3,14, 10 ,7264,1390,1109,9763
3/14/2013,2013,3,14, 11 ,7467,1431,1139,10037
3/14/2013,2013,3,14, 12 ,7351,1408,1137,9896
3/14/2013,2013,3,14, 13 ,7302,1413,1118,9833
3/14/2013,2013,3,14, 14 ,7542,1460,1150,10152
3/14/2013,2013,3,14, 15 ,7499,1431,1143,10073
3/14/2013,2013,3,14, 16 ,7331,1406,1141,9878
3/14/2013,2013,3,14, 17 ,6847,1300,1089,9236
3/14/2013,2013,3,14, 18 ,6686,1331,1143,9160
3/14/2013,2013,3,14, 19 ,7136,1482,1133,9751
3/14/2013,2013,3,14, 20 ,7035,1435,1132,9602
3/14/2013,2013,3,14, 21 ,6834,1385,1140,9359
3/14/2013,2013,3,14, 22 ,6475,1259,1109,8843
3/14/2013,2013,3,14, 23 ,6133,1119,995,8247
3/14/2013,2013,3,14, 24 ,5733,1049,937,7719
3/15/2013,2013,3,15, 1 ,5419,1003,882,7304
3/15/2013,2013,3,15, 2 ,5247,965,853,7065
3/15/2013,2013,3,15, 3 ,5070,938,821,6829
3/15/2013,2013,3,15, 4 ,5011,916,829,6756
3/15/2013,2013,3,15, 5 ,5060,949,854,6863
3/15/2013,2013,3,15, 6 ,5190,967,908,7065
3/15/2013,2013,3,15, 7 ,5280,951,859,7090
3/15/2013,2013,3,15, 8 ,5957,1083,958,7998
3/15/2013,2013,3,15, 9 ,6751,1275,1058,9084
3/15/2013,2013,3,15, 10 ,7091,1358,1112,9561
3/15/2013,2013,3,15, 11 ,7241,1408,1128,9777
3/15/2013,2013,3,15, 12 ,7138,1388,1090,9616
3/15/2013,2013,3,15, 13 ,7117,1398,1077,9592
3/15/2013,2013,3,15, 14 ,7289,1440,1122,9851
3/15/2013,2013,3,15, 15 ,7189,1412,1105,9706
3/15/2013,2013,3,15, 16 ,7082,1388,1106,9576
3/15/2013,2013,3,15, 17 ,6735,1296,1070,9101
3/15/2013,2013,3,15, 18 ,6509,1316,1091,8916
3/15/2013,2013,3,15, 19 ,6961,1453,1109,9523
3/15/2013,2013,3,15, 20 ,6846,1421,1103,9370
3/15/2013,2013,3,15, 21 ,6664,1378,1106,9148
3/15/2013,2013,3,15, 22 ,6333,1261,1075,8669
3/15/2013,2013,3,15, 23 ,5906,1140,1006,8052
3/15/2013,2013,3,15, 24 ,5600,1040,947,7587
3/16/2013,2013,3,16, 1 ,5291,978,866,7135
3/16/2013,2013,3,16, 2 ,5094,950,844,6888
3/16/2013,2013,3,16, 3 ,4914,922,825,6661
3/16/2013,2013,3,16, 4 ,4802,911,817,6530
3/16/2013,2013,3,16, 5 ,4849,925,833,6607
3/16/2013,2013,3,16, 6 ,4868,921,849,6638
3/16/2013,2013,3,16, 7 ,4839,934,852,6625
3/16/2013,2013,3,16, 8 ,5294,1023,882,7199
3/16/2013,2013,3,16, 9 ,5923,1154,954,8031
3/16/2013,2013,3,16, 10 ,6407,1229,985,8621
3/16/2013,2013,3,16, 11 ,6667,1274,1018,8959
3/16/2013,2013,3,16, 12 ,6564,1253,997,8814
3/16/2013,2013,3,16, 13 ,6464,1273,991,8728
3/16/2013,2013,3,16, 14 ,6635,1286,1011,8932
3/16/2013,2013,3,16, 15 ,6439,1189,980,8608
3/16/2013,2013,3,16, 16 ,6133,1219,973,8325
3/16/2013,2013,3,16, 17 ,6178,1190,972,8340
3/16/2013,2013,3,16, 18 ,6052,1248,1037,8337
3/16/2013,2013,3,16, 19 ,6613,1401,1026,9040
3/16/2013,2013,3,16, 20 ,6535,1376,1015,8926
3/16/2013,2013,3,16, 21 ,6403,1334,1029,8766
3/16/2013,2013,3,16, 22 ,6135,1236,1004,8375
3/16/2013,2013,3,16, 23 ,5691,1118,966,7775
3/16/2013,2013,3,16, 24 ,5406,1033,908,7347
3/17/2013,2013,3,17, 1 ,5105,977,877,6959
3/17/2013,2013,3,17, 2 ,4926,939,847,6712
3/17/2013,2013,3,17, 3 ,4757,918,833,6508
3/17/2013,2013,3,17, 4 ,4646,907,811,6364
3/17/2013,2013,3,17, 5 ,4587,910,822,6319
3/17/2013,2013,3,17, 6 ,4526,895,833,6254
3/17/2013,2013,3,17, 7 ,4432,889,782,6103
3/17/2013,2013,3,17, 8 ,4677,933,827,6437
3/17/2013,2013,3,17, 9 ,5111,1004,879,6994
3/17/2013,2013,3,17, 10 ,5612,1082,930,7624
3/17/2013,2013,3,17, 11 ,5786,1127,957,7870
3/17/2013,2013,3,17, 12 ,5753,1139,956,7848
3/17/2013,2013,3,17, 13 ,5796,1141,956,7893
3/17/2013,2013,3,17, 14 ,5863,1150,940,7953
3/17/2013,2013,3,17, 15 ,5772,1132,938,7842
3/17/2013,2013,3,17, 16 ,5633,1108,937,7678
3/17/2013,2013,3,17, 17 ,5532,1074,949,7555
3/17/2013,2013,3,17, 18 ,5615,1169,1054,7838
3/17/2013,2013,3,17, 19 ,6389,1360,1058,8807
3/17/2013,2013,3,17, 20 ,6296,1339,1052,8687
3/17/2013,2013,3,17, 21 ,6197,1281,1008,8486
3/17/2013,2013,3,17, 22 ,5917,1201,1012,8130
3/17/2013,2013,3,17, 23 ,5573,1100,945,7618
3/17/2013,2013,3,17, 24 ,5223,1011,891,7125
3/18/2013,2013,3,18, 1 ,4978,963,831,6772
3/18/2013,2013,3,18, 2 ,4758,933,790,6481
3/18/2013,2013,3,18, 3 ,4625,909,776,6310
3/18/2013,2013,3,18, 4 ,4551,897,766,6214
3/18/2013,2013,3,18, 5 ,4642,922,815,6379
3/18/2013,2013,3,18, 6 ,4789,946,858,6593
3/18/2013,2013,3,18, 7 ,4996,942,846,6784
3/18/2013,2013,3,18, 8 ,5747,1080,936,7763
3/18/2013,2013,3,18, 9 ,6591,1267,1053,8911
3/18/2013,2013,3,18, 10 ,7096,1379,1084,9559
3/18/2013,2013,3,18, 11 ,7365,1435,1100,9900
3/18/2013,2013,3,18, 12 ,7290,1399,1096,9785
3/18/2013,2013,3,18, 13 ,7270,1418,1102,9790
3/18/2013,2013,3,18, 14 ,7575,1462,1093,10130
3/18/2013,2013,3,18, 15 ,7490,1443,1081,10014
3/18/2013,2013,3,18, 16 ,7415,1398,1084,9897
3/18/2013,2013,3,18, 17 ,7045,1335,1059,9439
3/18/2013,2013,3,18, 18 ,6760,1378,1083,9221
3/18/2013,2013,3,18, 19 ,7211,1494,1085,9790
3/18/2013,2013,3,18, 20 ,7049,1449,1064,9562
3/18/2013,2013,3,18, 21 ,6879,1405,1077,9361
3/18/2013,2013,3,18, 22 ,6579,1298,1053,8930
3/18/2013,2013,3,18, 23 ,6079,1166,1004,8249
3/18/2013,2013,3,18, 24 ,5736,1088,948,7772
3/19/2013,2013,3,19, 1 ,5458,1031,916,7405
3/19/2013,2013,3,19, 2 ,5252,1005,875,7132
3/19/2013,2013,3,19, 3 ,5054,975,848,6877
3/19/2013,2013,3,19, 4 ,4985,963,842,6790
3/19/2013,2013,3,19, 5 ,5026,980,888,6894
3/19/2013,2013,3,19, 6 ,5109,998,907,7014
3/19/2013,2013,3,19, 7 ,5252,980,880,7112
3/19/2013,2013,3,19, 8 ,5984,1106,969,8059
3/19/2013,2013,3,19, 9 ,6760,1303,1036,9099
3/19/2013,2013,3,19, 10 ,7219,1406,1078,9703
3/19/2013,2013,3,19, 11 ,7521,1454,1108,10083
3/19/2013,2013,3,19, 12 ,7467,1430,1103,10000
3/19/2013,2013,3,19, 13 ,7409,1411,1087,9907
3/19/2013,2013,3,19, 14 ,7667,1479,1118,10264
3/19/2013,2013,3,19, 15 ,7579,1450,1114,10143
3/19/2013,2013,3,19, 16 ,7386,1426,1107,9919
3/19/2013,2013,3,19, 17 ,7097,1343,1044,9484
3/19/2013,2013,3,19, 18 ,6802,1348,1083,9233
3/19/2013,2013,3,19, 19 ,7298,1488,1088,9874
3/19/2013,2013,3,19, 20 ,7150,1446,1092,9688
3/19/2013,2013,3,19, 21 ,6947,1377,1093,9417
3/19/2013,2013,3,19, 22 ,6629,1252,1063,8944
3/19/2013,2013,3,19, 23 ,6182,1137,1035,8354
3/19/2013,2013,3,19, 24 ,5715,1060,969,7744
3/20/2013,2013,3,20, 1 ,5463,1009,904,7376
3/20/2013,2013,3,20, 2 ,5221,967,888,7076
3/20/2013,2013,3,20, 3 ,5070,948,868,6886
3/20/2013,2013,3,20, 4 ,4972,933,849,6754
3/20/2013,2013,3,20, 5 ,4975,950,869,6794
3/20/2013,2013,3,20, 6 ,5067,962,903,6932
3/20/2013,2013,3,20, 7 ,5172,954,894,7020
3/20/2013,2013,3,20, 8 ,5965,1085,998,8048
3/20/2013,2013,3,20, 9 ,6669,1282,1072,9023
3/20/2013,2013,3,20, 10 ,7179,1376,1119,9674
3/20/2013,2013,3,20, 11 ,7435,1448,1134,10017
3/20/2013,2013,3,20, 12 ,7344,1410,1120,9874
3/20/2013,2013,3,20, 13 ,7379,1417,1129,9925
3/20/2013,2013,3,20, 14 ,7632,1463,1142,10237
3/20/2013,2013,3,20, 15 ,7509,1441,1124,10074
3/20/2013,2013,3,20, 16 ,7393,1402,1129,9924
3/20/2013,2013,3,20, 17 ,6978,1316,1103,9397
3/20/2013,2013,3,20, 18 ,6669,1337,1124,9130
3/20/2013,2013,3,20, 19 ,7185,1469,1153,9807
3/20/2013,2013,3,20, 20 ,7084,1436,1143,9663
3/20/2013,2013,3,20, 21 ,6929,1380,1144,9453
3/20/2013,2013,3,20, 22 ,6517,1261,1105,8883
3/20/2013,2013,3,20, 23 ,6140,1148,1050,8338
3/20/2013,2013,3,20, 24 ,5798,1065,970,7833
3/21/2013,2013,3,21, 1 ,5450,1019,926,7395
3/21/2013,2013,3,21, 2 ,5277,993,891,7161
3/21/2013,2013,3,21, 3 ,5078,965,862,6905
3/21/2013,2013,3,21, 4 ,4955,949,853,6757
3/21/2013,2013,3,21, 5 ,4956,966,870,6792
3/21/2013,2013,3,21, 6 ,4986,987,911,6884
3/21/2013,2013,3,21, 7 ,5159,978,893,7030
3/21/2013,2013,3,21, 8 ,5879,1112,980,7971
3/21/2013,2013,3,21, 9 ,6630,1297,1067,8994
3/21/2013,2013,3,21, 10 ,7094,1384,1114,9592
3/21/2013,2013,3,21, 11 ,7454,1441,1151,10046
3/21/2013,2013,3,21, 12 ,7295,1440,1126,9861
3/21/2013,2013,3,21, 13 ,7306,1423,1115,9844
3/21/2013,2013,3,21, 14 ,7550,1417,1130,10097
3/21/2013,2013,3,21, 15 ,7384,1422,1101,9907
3/21/2013,2013,3,21, 16 ,7274,1412,1077,9763
3/21/2013,2013,3,21, 17 ,6906,1354,1055,9315
3/21/2013,2013,3,21, 18 ,6714,1425,1101,9240
3/21/2013,2013,3,21, 19 ,7141,1481,1086,9708
3/21/2013,2013,3,21, 20 ,6959,1445,1071,9475
3/21/2013,2013,3,21, 21 ,6816,1365,1056,9237
3/21/2013,2013,3,21, 22 ,6809,1301,1014,9124
3/21/2013,2013,3,21, 23 ,6114,1182,996,8292
3/21/2013,2013,3,21, 24 ,5753,1076,914,7743
3/22/2013,2013,3,22, 1 ,5461,1048,879,7388
3/22/2013,2013,3,22, 2 ,5256,1003,852,7111
3/22/2013,2013,3,22, 3 ,5119,987,833,6939
3/22/2013,2013,3,22, 4 ,5061,971,830,6862
3/22/2013,2013,3,22, 5 ,5087,977,848,6912
3/22/2013,2013,3,22, 6 ,5182,993,882,7057
3/22/2013,2013,3,22, 7 ,5306,996,886,7188
3/22/2013,2013,3,22, 8 ,5977,1141,961,8079
3/22/2013,2013,3,22, 9 ,6687,1320,1065,9072
3/22/2013,2013,3,22, 10 ,7207,1422,1093,9722
3/22/2013,2013,3,22, 11 ,7435,1488,1130,10053
3/22/2013,2013,3,22, 12 ,7299,1453,1140,9892
3/22/2013,2013,3,22, 13 ,7056,1466,1156,9678
3/22/2013,2013,3,22, 14 ,7177,1503,1137,9817
3/22/2013,2013,3,22, 15 ,7069,1470,1096,9635
3/22/2013,2013,3,22, 16 ,7018,1435,1085,9538
3/22/2013,2013,3,22, 17 ,6731,1345,1037,9113
3/22/2013,2013,3,22, 18 ,6614,1400,1123,9137
3/22/2013,2013,3,22, 19 ,7055,1522,1106,9683
3/22/2013,2013,3,22, 20 ,6877,1445,1098,9420
3/22/2013,2013,3,22, 21 ,6747,1388,1079,9214
3/22/2013,2013,3,22, 22 ,6396,1300,1029,8725
3/22/2013,2013,3,22, 23 ,5978,1193,968,8139
3/22/2013,2013,3,22, 24 ,5591,1114,916,7621
3/23/2013,2013,3,23, 1 ,5348,1070,877,7295
3/23/2013,2013,3,23, 2 ,5180,1029,831,7040
3/23/2013,2013,3,23, 3 ,5028,1006,821,6855
3/23/2013,2013,3,23, 4 ,4948,986,804,6738
3/23/2013,2013,3,23, 5 ,4922,997,804,6723
3/23/2013,2013,3,23, 6 ,4852,989,800,6641
3/23/2013,2013,3,23, 7 ,4990,976,830,6796
3/23/2013,2013,3,23, 8 ,5463,1077,905,7445
3/23/2013,2013,3,23, 9 ,6072,1219,1005,8296
3/23/2013,2013,3,23, 10 ,6548,1306,1095,8949
3/23/2013,2013,3,23, 11 ,6931,1362,1140,9433
3/23/2013,2013,3,23, 12 ,6716,1332,1116,9164
3/23/2013,2013,3,23, 13 ,6697,1356,1133,9186
3/23/2013,2013,3,23, 14 ,6852,1387,1135,9374
3/23/2013,2013,3,23, 15 ,6682,1352,1132,9166
3/23/2013,2013,3,23, 16 ,6443,1301,1112,8856
3/23/2013,2013,3,23, 17 ,6213,1230,1104,8547
3/23/2013,2013,3,23, 18 ,6167,1305,1173,8645
3/23/2013,2013,3,23, 19 ,6754,1444,1181,9379
3/23/2013,2013,3,23, 20 ,6691,1405,1163,9259
3/23/2013,2013,3,23, 21 ,6455,1349,1112,8916
3/23/2013,2013,3,23, 22 ,6304,1293,1087,8684
3/23/2013,2013,3,23, 23 ,6014,1181,1001,8196
3/23/2013,2013,3,23, 24 ,5648,1102,932,7682
3/24/2013,2013,3,24, 1 ,5359,1046,869,7274
3/24/2013,2013,3,24, 2 ,5168,1010,847,7025
3/24/2013,2013,3,24, 3 ,5025,981,812,6818
3/24/2013,2013,3,24, 4 ,4942,966,799,6707
3/24/2013,2013,3,24, 5 ,4824,965,809,6598
3/24/2013,2013,3,24, 6 ,4646,929,809,6384
3/24/2013,2013,3,24, 7 ,4642,925,792,6359
3/24/2013,2013,3,24, 8 ,4899,968,841,6708
3/24/2013,2013,3,24, 9 ,5323,1044,834,7201
3/24/2013,2013,3,24, 10 ,5724,1128,908,7760
3/24/2013,2013,3,24, 11 ,6052,1174,982,8208
3/24/2013,2013,3,24, 12 ,5975,1183,1003,8161
3/24/2013,2013,3,24, 13 ,6022,1202,1029,8253
3/24/2013,2013,3,24, 14 ,6104,1209,1041,8354
3/24/2013,2013,3,24, 15 ,6004,1201,1022,8227
3/24/2013,2013,3,24, 16 ,5864,1167,1008,8039
3/24/2013,2013,3,24, 17 ,5732,1125,987,7844
3/24/2013,2013,3,24, 18 ,5818,1217,1149,8184
3/24/2013,2013,3,24, 19 ,6497,1394,1220,9111
3/24/2013,2013,3,24, 20 ,6441,1358,1202,9001
3/24/2013,2013,3,24, 21 ,6283,1307,1167,8757
3/24/2013,2013,3,24, 22 ,5973,1234,1073,8280
3/24/2013,2013,3,24, 23 ,5765,1143,990,7898
3/24/2013,2013,3,24, 24 ,5374,1059,916,7349
3/25/2013,2013,3,25, 1 ,5158,1019,856,7033
3/25/2013,2013,3,25, 2 ,4958,980,841,6779
3/25/2013,2013,3,25, 3 ,4845,957,826,6628
3/25/2013,2013,3,25, 4 ,4745,940,808,6493
3/25/2013,2013,3,25, 5 ,4795,944,822,6561
3/25/2013,2013,3,25, 6 ,4854,958,844,6656
3/25/2013,2013,3,25, 7 ,5130,979,857,6966
3/25/2013,2013,3,25, 8 ,5935,1125,971,8031
3/25/2013,2013,3,25, 9 ,6706,1316,1100,9122
3/25/2013,2013,3,25, 10 ,7185,1426,1152,9763
3/25/2013,2013,3,25, 11 ,7478,1476,1173,10127
3/25/2013,2013,3,25, 12 ,7359,1461,1168,9988
3/25/2013,2013,3,25, 13 ,7244,1451,1182,9877
3/25/2013,2013,3,25, 14 ,7502,1485,1173,10160
3/25/2013,2013,3,25, 15 ,7358,1443,1153,9954
3/25/2013,2013,3,25, 16 ,7247,1416,1147,9810
3/25/2013,2013,3,25, 17 ,6904,1338,1115,9357
3/25/2013,2013,3,25, 18 ,6614,1387,1180,9181
3/25/2013,2013,3,25, 19 ,7009,1481,1184,9674
3/25/2013,2013,3,25, 20 ,6952,1458,1161,9571
3/25/2013,2013,3,25, 21 ,6794,1393,1137,9324
3/25/2013,2013,3,25, 22 ,6402,1275,1102,8779
3/25/2013,2013,3,25, 23 ,6041,1158,983,8182
3/25/2013,2013,3,25, 24 ,5639,1062,935,7636
3/26/2013,2013,3,26, 1 ,5394,1040,881,7315
3/26/2013,2013,3,26, 2 ,5174,1003,857,7034
3/26/2013,2013,3,26, 3 ,5052,972,831,6855
3/26/2013,2013,3,26, 4 ,4929,957,821,6707
3/26/2013,2013,3,26, 5 ,4960,967,839,6766
3/26/2013,2013,3,26, 6 ,4936,963,842,6741
3/26/2013,2013,3,26, 7 ,5183,976,859,7018
3/26/2013,2013,3,26, 8 ,5976,1127,976,8079
3/26/2013,2013,3,26, 9 ,6624,1313,1124,9061
3/26/2013,2013,3,26, 10 ,7083,1397,1164,9644
3/26/2013,2013,3,26, 11 ,7308,1456,1187,9951
3/26/2013,2013,3,26, 12 ,7222,1423,1173,9818
3/26/2013,2013,3,26, 13 ,7228,1430,1190,9848
3/26/2013,2013,3,26, 14 ,7417,1477,1200,10094
3/26/2013,2013,3,26, 15 ,7363,1455,1187,10005
3/26/2013,2013,3,26, 16 ,7155,1426,1178,9759
3/26/2013,2013,3,26, 17 ,6835,1327,1135,9297
3/26/2013,2013,3,26, 18 ,6603,1346,1181,9130
3/26/2013,2013,3,26, 19 ,7010,1486,1195,9691
3/26/2013,2013,3,26, 20 ,6809,1441,1220,9470
3/26/2013,2013,3,26, 21 ,6672,1370,1218,9260
3/26/2013,2013,3,26, 22 ,6342,1268,1151,8761
3/26/2013,2013,3,26, 23 ,5974,1189,1042,8205
3/26/2013,2013,3,26, 24 ,5661,1106,967,7734
3/27/2013,2013,3,27, 1 ,5369,1048,914,7331
3/27/2013,2013,3,27, 2 ,5155,1013,876,7044
3/27/2013,2013,3,27, 3 ,4980,991,863,6834
3/27/2013,2013,3,27, 4 ,4894,963,845,6702
3/27/2013,2013,3,27, 5 ,4871,978,858,6707
3/27/2013,2013,3,27, 6 ,4814,969,877,6660
3/27/2013,2013,3,27, 7 ,4954,968,874,6796
3/27/2013,2013,3,27, 8 ,5652,1112,990,7754
3/27/2013,2013,3,27, 9 ,6377,1298,1140,8815
3/27/2013,2013,3,27, 10 ,6841,1382,1164,9387
3/27/2013,2013,3,27, 11 ,7063,1432,1161,9656
3/27/2013,2013,3,27, 12 ,6962,1391,1129,9482
3/27/2013,2013,3,27, 13 ,6914,1358,1150,9422
3/27/2013,2013,3,27, 14 ,7111,1391,1132,9634
3/27/2013,2013,3,27, 15 ,6957,1333,1132,9422
3/27/2013,2013,3,27, 16 ,6748,1298,1125,9171
3/27/2013,2013,3,27, 17 ,6341,1227,1121,8689
3/27/2013,2013,3,27, 18 ,6212,1287,1148,8647
3/27/2013,2013,3,27, 19 ,6682,1396,1150,9228
3/27/2013,2013,3,27, 20 ,6546,1341,1183,9070
3/27/2013,2013,3,27, 21 ,6373,1297,1173,8843
3/27/2013,2013,3,27, 22 ,6052,1216,1065,8333
3/27/2013,2013,3,27, 23 ,5699,1107,990,7796
3/27/2013,2013,3,27, 24 ,5341,1051,913,7305
3/28/2013,2013,3,28, 1 ,5025,989,860,6874
3/28/2013,2013,3,28, 2 ,4854,951,827,6632
3/28/2013,2013,3,28, 3 ,4641,929,804,6374
3/28/2013,2013,3,28, 4 ,4536,909,788,6233
3/28/2013,2013,3,28, 5 ,4415,906,793,6114
3/28/2013,2013,3,28, 6 ,4165,861,779,5805
3/28/2013,2013,3,28, 7 ,3971,847,765,5583
3/28/2013,2013,3,28, 8 ,4128,899,802,5829
3/28/2013,2013,3,28, 9 ,4370,972,900,6242
3/28/2013,2013,3,28, 10 ,4591,1023,928,6542
3/28/2013,2013,3,28, 11 ,4819,1053,973,6845
3/28/2013,2013,3,28, 12 ,4792,1059,976,6827
3/28/2013,2013,3,28, 13 ,4811,1066,981,6858
3/28/2013,2013,3,28, 14 ,4944,1075,994,7013
3/28/2013,2013,3,28, 15 ,4854,1060,972,6886
3/28/2013,2013,3,28, 16 ,4743,1014,947,6704
3/28/2013,2013,3,28, 17 ,4542,983,921,6446
3/28/2013,2013,3,28, 18 ,4665,1089,1022,6776
3/28/2013,2013,3,28, 19 ,5350,1247,1073,7670
3/28/2013,2013,3,28, 20 ,5378,1241,1071,7690
3/28/2013,2013,3,28, 21 ,5389,1214,1058,7661
3/28/2013,2013,3,28, 22 ,5315,1147,1014,7476
3/28/2013,2013,3,28, 23 ,5095,1068,930,7093
3/28/2013,2013,3,28, 24 ,4770,995,864,6629
3/29/2013,2013,3,29, 1 ,4489,934,804,6227
3/29/2013,2013,3,29, 2 ,4328,910,780,6018
3/29/2013,2013,3,29, 3 ,4175,881,751,5807
3/29/2013,2013,3,29, 4 ,4042,865,727,5634
3/29/2013,2013,3,29, 5 ,3976,859,724,5559
3/29/2013,2013,3,29, 6 ,3745,810,704,5259
3/29/2013,2013,3,29, 7 ,3612,792,684,5088
3/29/2013,2013,3,29, 8 ,3697,818,702,5217
3/29/2013,2013,3,29, 9 ,3861,857,737,5455
3/29/2013,2013,3,29, 10 ,4035,880,778,5693
3/29/2013,2013,3,29, 11 ,4200,922,804,5926
3/29/2013,2013,3,29, 12 ,4196,930,835,5961
3/29/2013,2013,3,29, 13 ,4237,937,827,6001
3/29/2013,2013,3,29, 14 ,4335,950,844,6129
3/29/2013,2013,3,29, 15 ,4277,932,827,6036
3/29/2013,2013,3,29, 16 ,4181,898,799,5878
3/29/2013,2013,3,29, 17 ,4035,863,771,5669
3/29/2013,2013,3,29, 18 ,4161,960,931,6052
3/29/2013,2013,3,29, 19 ,4862,1132,1053,7047
3/29/2013,2013,3,29, 20 ,4973,1141,1048,7162
3/29/2013,2013,3,29, 21 ,5066,1120,1008,7194
3/29/2013,2013,3,29, 22 ,5044,1086,952,7082
3/29/2013,2013,3,29, 23 ,4817,1010,877,6704
3/29/2013,2013,3,29, 24 ,4576,959,823,6358
3/30/2013,2013,3,30, 1 ,4312,915,785,6012
3/30/2013,2013,3,30, 2 ,4141,885,756,5782
3/30/2013,2013,3,30, 3 ,4016,863,737,5616
3/30/2013,2013,3,30, 4 ,3937,851,726,5514
3/30/2013,2013,3,30, 5 ,3892,856,735,5483
3/30/2013,2013,3,30, 6 ,3777,829,724,5330
3/30/2013,2013,3,30, 7 ,3806,836,732,5374
3/30/2013,2013,3,30, 8 ,4163,912,797,5872
3/30/2013,2013,3,30, 9 ,4555,1030,899,6484
3/30/2013,2013,3,30, 10 ,4997,1086,987,7070
3/30/2013,2013,3,30, 11 ,5210,1134,1038,7382
3/30/2013,2013,3,30, 12 ,5143,1134,1036,7313
3/30/2013,2013,3,30, 13 ,5166,1141,1057,7364
3/30/2013,2013,3,30, 14 ,5252,1157,1057,7466
3/30/2013,2013,3,30, 15 ,5164,1148,1055,7367
3/30/2013,2013,3,30, 16 ,5092,1126,1048,7266
3/30/2013,2013,3,30, 17 ,4965,1091,1027,7083
3/30/2013,2013,3,30, 18 ,5058,1167,1113,7338
3/30/2013,2013,3,30, 19 ,5821,1333,1192,8346
3/30/2013,2013,3,30, 20 ,5753,1298,1168,8219
3/30/2013,2013,3,30, 21 ,5724,1236,1129,8089
3/30/2013,2013,3,30, 22 ,5567,1162,1060,7789
3/30/2013,2013,3,30, 23 ,5233,1073,975,7281
3/30/2013,2013,3,30, 24 ,4943,1006,897,6846
3/31/2013,2013,3,31, 1 ,4698,968,855,6521
3/31/2013,2013,3,31, 2 ,4594,937,831,6362
3/31/2013,2013,3,31, 3 ,4484,914,815,6213
3/31/2013,2013,3,31, 4 ,4329,893,798,6020
3/31/2013,2013,3,31, 5 ,4267,885,791,5943
3/31/2013,2013,3,31, 6 ,4125,856,780,5761
3/31/2013,2013,3,31, 7 ,4153,854,778,5785
3/31/2013,2013,3,31, 8 ,4429,898,824,6151
3/31/2013,2013,3,31, 9 ,4761,967,877,6605
3/31/2013,2013,3,31, 10 ,5187,1027,968,7182
3/31/2013,2013,3,31, 11 ,5470,1066,1010,7546
3/31/2013,2013,3,31, 12 ,5470,1060,1010,7540
3/31/2013,2013,3,31, 13 ,5521,1062,1017,7600
3/31/2013,2013,3,31, 14 ,5595,1070,1011,7676
3/31/2013,2013,3,31, 15 ,5592,1062,1009,7663
3/31/2013,2013,3,31, 16 ,5486,1031,998,7515
3/31/2013,2013,3,31, 17 ,5259,1021,1007,7287
3/31/2013,2013,3,31, 18 ,5366,1142,1114,7622
3/31/2013,2013,3,31, 19 ,6159,1318,1210,8687
3/31/2013,2013,3,31, 20 ,6113,1297,1183,8593
3/31/2013,2013,3,31, 21 ,6018,1240,1158,8416
3/31/2013,2013,3,31, 22 ,5878,1159,1059,8096
3/31/2013,2013,3,31, 23 ,5496,1077,953,7526
3/31/2013,2013,3,31, 24 ,5240,1012,894,7146
4/1/2013,2013,4,1, 1 ,4978,955,870,6803
4/1/2013,2013,4,1, 2 ,4764,928,830,6522
4/1/2013,2013,4,1, 3 ,4643,904,802,6349
4/1/2013,2013,4,1, 4 ,4593,891,793,6277
4/1/2013,2013,4,1, 5 ,4566,909,815,6290
4/1/2013,2013,4,1, 6 ,4615,912,831,6358
4/1/2013,2013,4,1, 7 ,4898,940,855,6693
4/1/2013,2013,4,1, 8 ,5744,1101,981,7826
4/1/2013,2013,4,1, 9 ,6514,1290,1083,8887
4/1/2013,2013,4,1, 10 ,6994,1377,1098,9469
4/1/2013,2013,4,1, 11 ,7346,1446,1149,9941
4/1/2013,2013,4,1, 12 ,7234,1421,1137,9792
4/1/2013,2013,4,1, 13 ,7258,1435,1107,9800
4/1/2013,2013,4,1, 14 ,7494,1483,1128,10105
4/1/2013,2013,4,1, 15 ,7380,1453,1112,9945
4/1/2013,2013,4,1, 16 ,7289,1425,1109,9823
4/1/2013,2013,4,1, 17 ,6946,1334,1109,9389
4/1/2013,2013,4,1, 18 ,6655,1350,1124,9129
4/1/2013,2013,4,1, 19 ,7055,1481,1105,9641
4/1/2013,2013,4,1, 20 ,6991,1440,1107,9538
4/1/2013,2013,4,1, 21 ,6754,1399,1072,9225
4/1/2013,2013,4,1, 22 ,6551,1302,1025,8878
4/1/2013,2013,4,1, 23 ,6215,1185,962,8362
4/1/2013,2013,4,1, 24 ,5836,1102,876,7814
4/2/2013,2013,4,2, 1 ,5645,1054,844,7543
4/2/2013,2013,4,2, 2 ,5458,1012,824,7294
4/2/2013,2013,4,2, 3 ,5250,983,809,7042
4/2/2013,2013,4,2, 4 ,5104,970,797,6871
4/2/2013,2013,4,2, 5 ,5143,975,814,6932
4/2/2013,2013,4,2, 6 ,5087,963,834,6884
4/2/2013,2013,4,2, 7 ,5333,972,848,7153
4/2/2013,2013,4,2, 8 ,6082,1121,968,8171
4/2/2013,2013,4,2, 9 ,6876,1321,1060,9257
4/2/2013,2013,4,2, 10 ,7319,1405,1103,9827
4/2/2013,2013,4,2, 11 ,7549,1468,1131,10148
4/2/2013,2013,4,2, 12 ,7493,1435,1116,10044
4/2/2013,2013,4,2, 13 ,7452,1433,1131,10016
4/2/2013,2013,4,2, 14 ,7686,1480,1170,10336
4/2/2013,2013,4,2, 15 ,7589,1458,1166,10213
4/2/2013,2013,4,2, 16 ,7425,1433,1130,9988
4/2/2013,2013,4,2, 17 ,7007,1320,1093,9420
4/2/2013,2013,4,2, 18 ,6752,1334,1145,9231
4/2/2013,2013,4,2, 19 ,7120,1451,1174,9745
4/2/2013,2013,4,2, 20 ,7039,1419,1173,9631
4/2/2013,2013,4,2, 21 ,6916,1361,1145,9422
4/2/2013,2013,4,2, 22 ,6587,1279,1150,9016
4/2/2013,2013,4,2, 23 ,6286,1161,1048,8495
4/2/2013,2013,4,2, 24 ,5973,1077,965,8015
4/3/2013,2013,4,3, 1 ,5664,1029,913,7606
4/3/2013,2013,4,3, 2 ,5502,998,889,7389
4/3/2013,2013,4,3, 3 ,5296,971,865,7132
4/3/2013,2013,4,3, 4 ,5157,957,841,6955
4/3/2013,2013,4,3, 5 ,5192,958,861,7011
4/3/2013,2013,4,3, 6 ,5134,955,896,6985
4/3/2013,2013,4,3, 7 ,5296,971,888,7155
4/3/2013,2013,4,3, 8 ,6041,1121,1023,8185
4/3/2013,2013,4,3, 9 ,6849,1328,1112,9289
4/3/2013,2013,4,3, 10 ,7277,1408,1159,9844
4/3/2013,2013,4,3, 11 ,7608,1462,1196,10266
4/3/2013,2013,4,3, 12 ,7420,1427,1183,10030
4/3/2013,2013,4,3, 13 ,7483,1432,1171,10086
4/3/2013,2013,4,3, 14 ,7712,1488,1206,10406
4/3/2013,2013,4,3, 15 ,7695,1460,1190,10345
4/3/2013,2013,4,3, 16 ,7574,1410,1164,10148
4/3/2013,2013,4,3, 17 ,7121,1320,1149,9590
4/3/2013,2013,4,3, 18 ,6839,1336,1178,9353
4/3/2013,2013,4,3, 19 ,7260,1465,1189,9914
4/3/2013,2013,4,3, 20 ,7163,1420,1197,9780
4/3/2013,2013,4,3, 21 ,6995,1374,1170,9539
4/3/2013,2013,4,3, 22 ,6764,1306,1143,9213
4/3/2013,2013,4,3, 23 ,6398,1192,1092,8682
4/3/2013,2013,4,3, 24 ,6007,1101,1017,8125
4/4/2013,2013,4,4, 1 ,5766,1051,979,7796
4/4/2013,2013,4,4, 2 ,5584,1017,948,7549
4/4/2013,2013,4,4, 3 ,5408,997,909,7314
4/4/2013,2013,4,4, 4 ,5274,987,890,7151
4/4/2013,2013,4,4, 5 ,5259,987,917,7163
4/4/2013,2013,4,4, 6 ,5153,979,915,7047
4/4/2013,2013,4,4, 7 ,5359,1001,924,7284
4/4/2013,2013,4,4, 8 ,6140,1154,1023,8317
4/4/2013,2013,4,4, 9 ,6934,1348,1114,9396
4/4/2013,2013,4,4, 10 ,7345,1436,1163,9944
4/4/2013,2013,4,4, 11 ,7570,1490,1163,10223
4/4/2013,2013,4,4, 12 ,7451,1461,1182,10094
4/4/2013,2013,4,4, 13 ,7555,1468,1181,10204
4/4/2013,2013,4,4, 14 ,7775,1504,1189,10468
4/4/2013,2013,4,4, 15 ,7702,1480,1181,10363
4/4/2013,2013,4,4, 16 ,7558,1471,1166,10195
4/4/2013,2013,4,4, 17 ,7193,1353,1111,9657
4/4/2013,2013,4,4, 18 ,6935,1386,1174,9495
4/4/2013,2013,4,4, 19 ,7345,1503,1170,10018
4/4/2013,2013,4,4, 20 ,7248,1468,1150,9866
4/4/2013,2013,4,4, 21 ,7065,1408,1148,9621
4/4/2013,2013,4,4, 22 ,6820,1323,1118,9261
4/4/2013,2013,4,4, 23 ,6535,1223,1068,8826
4/4/2013,2013,4,4, 24 ,6128,1154,990,8272
4/5/2013,2013,4,5, 1 ,5871,1091,940,7902
4/5/2013,2013,4,5, 2 ,5688,1057,904,7649
4/5/2013,2013,4,5, 3 ,5469,1011,873,7353
4/5/2013,2013,4,5, 4 ,5318,1004,864,7186
4/5/2013,2013,4,5, 5 ,5337,1024,878,7239
4/5/2013,2013,4,5, 6 ,5253,999,893,7145
4/5/2013,2013,4,5, 7 ,5409,1019,894,7322
4/5/2013,2013,4,5, 8 ,6233,1219,1026,8478
4/5/2013,2013,4,5, 9 ,6950,1361,1101,9412
4/5/2013,2013,4,5, 10 ,7359,1431,1144,9934
4/5/2013,2013,4,5, 11 ,7665,1467,1170,10302
4/5/2013,2013,4,5, 12 ,7519,1459,1173,10151
4/5/2013,2013,4,5, 13 ,7572,1412,1160,10144
4/5/2013,2013,4,5, 14 ,7861,1462,1176,10499
4/5/2013,2013,4,5, 15 ,7790,1444,1184,10418
4/5/2013,2013,4,5, 16 ,7612,1414,1170,10196
4/5/2013,2013,4,5, 17 ,7210,1333,1112,9655
4/5/2013,2013,4,5, 18 ,6833,1355,1171,9359
4/5/2013,2013,4,5, 19 ,7343,1457,1172,9972
4/5/2013,2013,4,5, 20 ,7242,1418,1168,9828
4/5/2013,2013,4,5, 21 ,7158,1381,1179,9718
4/5/2013,2013,4,5, 22 ,6881,1288,1134,9303
4/5/2013,2013,4,5, 23 ,6584,1189,1067,8840
4/5/2013,2013,4,5, 24 ,6265,1113,995,8373
4/6/2013,2013,4,6, 1 ,5913,1045,938,7896
4/6/2013,2013,4,6, 2 ,5750,1014,926,7690
4/6/2013,2013,4,6, 3 ,5573,990,891,7454
4/6/2013,2013,4,6, 4 ,5437,967,897,7301
4/6/2013,2013,4,6, 5 ,5346,972,886,7204
4/6/2013,2013,4,6, 6 ,5234,952,844,7030
4/6/2013,2013,4,6, 7 ,5280,965,884,7129
4/6/2013,2013,4,6, 8 ,5769,1061,963,7793
4/6/2013,2013,4,6, 9 ,6399,1200,1069,8668
4/6/2013,2013,4,6, 10 ,6868,1289,1156,9313
4/6/2013,2013,4,6, 11 ,7133,1334,1184,9651
4/6/2013,2013,4,6, 12 ,7045,1324,1158,9527
4/6/2013,2013,4,6, 13 ,7035,1323,1175,9533
4/6/2013,2013,4,6, 14 ,7219,1350,1180,9749
4/6/2013,2013,4,6, 15 ,7045,1314,1161,9520
4/6/2013,2013,4,6, 16 ,6823,1270,1175,9268
4/6/2013,2013,4,6, 17 ,6499,1111,1097,8707
4/6/2013,2013,4,6, 18 ,6384,1170,1169,8723
4/6/2013,2013,4,6, 19 ,6995,1329,1177,9501
4/6/2013,2013,4,6, 20 ,6955,1287,1207,9449
4/6/2013,2013,4,6, 21 ,6907,1321,1217,9445
4/6/2013,2013,4,6, 22 ,6765,1255,1186,9206
4/6/2013,2013,4,6, 23 ,6393,1185,1118,8696
4/6/2013,2013,4,6, 24 ,6086,1109,1041,8236
4/7/2013,2013,4,7, 1 ,5802,1049,972,7823
4/7/2013,2013,4,7, 2 ,5429,1018,947,7394
4/7/2013,2013,4,7, 3 ,5381,987,915,7283
4/7/2013,2013,4,7, 4 ,5208,975,906,7089
4/7/2013,2013,4,7, 5 ,5131,967,920,7018
4/7/2013,2013,4,7, 6 ,4843,926,891,6660
4/7/2013,2013,4,7, 7 ,4784,907,857,6548
4/7/2013,2013,4,7, 8 ,5084,960,861,6905
4/7/2013,2013,4,7, 9 ,5414,1040,903,7357
4/7/2013,2013,4,7, 10 ,5907,1126,988,8021
4/7/2013,2013,4,7, 11 ,6196,1198,1073,8467
4/7/2013,2013,4,7, 12 ,6324,1190,1093,8607
4/7/2013,2013,4,7, 13 ,6148,1200,1100,8448
4/7/2013,2013,4,7, 14 ,6246,1208,1101,8555
